90099|NECKLACE+BRACELET SET BLUE HIBISCUS|51000
85131D|BEADED CRYSTAL HEART PINK ON STICK|25000
23231|WRAP  VINTAGE DOILY |8400
72140E|BEST DAD CANDLE LETTERS|17000
22293|HANGING CHICK GREEN DECORATION|29000
22150|3 STRIPEY MICE FELTCRAFT|39000
84012|MAGIC SHEEP WOOL GROWING FROM PAPER|17000
85018D|YULETIDE IMAGES S/6 PAPER BOXES|51000
20828|GLITTER BUTTERFLY CLIPS|51000
85114A|BLACK ENCHANTED FOREST PLACEMAT|65800
72122|COFFEE SCENT PILLAR CANDLE|19000
22186|RED STAR CARD HOLDER|39000
22591|CARDHOLDER GINGHAM CHRISTMAS TREE|65000
23394|POSTE FRANCE CUSHION COVER|215800
62096A|PINK/YELLOW FLOWERS HANDBAG|25000
22188|BLACK HEART CARD HOLDER|79000
90116|FRUIT SALAD BAG CHARM|33800
20838|FRENCH LATTICE CUSHION COVER |65800
23509|MINI PLAYING CARDS FUN FAIR |8400
23234|BISCUIT TIN VINTAGE CHRISTMAS|57800
22473|TV DINNER TRAY VINTAGE PAISLEY|0
72799F|IVORY PILLAR CANDLE GOLD FLOCK|59000
23237|SET OF 4 KNICK KNACK TINS LEAF|83000
23515|EMBROIDERED RIBBON REEL DAISY |41600
23111|PARISIENNE SEWING BOX|250000
47567B|TEA TIME KITCHEN APRON|119000
22817|CARD SUKI BIRTHDAY|8600
22357|KINGS CHOICE BISCUIT TIN|169400
22163|HEART STRING MEMO HOLDER HANGING|32600
85230E|STRAWBRY SCENTED VOTIVE CANDLE|4200
22367|CHILDRENS APRON SPACEBOY DESIGN|82600
23396|LA JARDIN BOTANIQUE CUSHION COVER|215800
85199S|SMALL HANGING IVORY/RED WOOD BIRD|16600
22410|MONEY BOX HOUSEKEEPING DESIGN|25000
22264|FELT FARM ANIMAL WHITE BUNNY |16200
90064B|BLACK VINTAGE  CRYSTAL EARRINGS|75000
23518|EMBROIDERED RIBBON REEL RACHEL |57800
23534|STOP FOR TEA WALL ART|119000
21561|DINOSAUR LUNCH BOX WITH CUTLERY|51000
23061|VINTAGE EMBOSSED HEART|25000
22710|WRAP I LOVE LONDON |8400
22541|MINI JIGSAW LEAP FROG|16600
79164|BLACK WINE GLASS|7800
22059|CERAMIC STRAWBERRY DESIGN MUG|29800
37489D|PINK/GREEN FLOWER DESIGN BIG MUG|7800
21889|WOODEN BOX OF DOMINOES|25000
22999|TRAVEL CARD WALLET VINTAGE LEAF|8400
47591D|PINK FAIRY CAKE CHILDRENS APRON|39000
22953|BIRTHDAY PARTY CORDON BARRIER TAPE|49200
62074B|ELEPHANT CLIP W SUCTION CUP|8400
22424|ENAMEL BREAD BIN CREAM|509800
35599D|PINK AND WHITE CHRISTMAS TREE 120CM|59000
85183A|CHARLIE & LOLA WASTEPAPER BIN BLUE|25000
23470|CARD HOLDER LOVE BIRD LARGE |125000
21718|RED METAL BEACH SPADE |25000
22109|FULL ENGLISH BREAKFAST PLATE|67800
22031|BOTANICAL LAVENDER BIRTHDAY CARD|17000
22381|TOY TIDY PINK POLKADOT|82600
22311|OFFICE MUG WARMER BLACK+SILVER |59000
22954|HEN PARTY CORDON BARRIER TAPE|50200
85032A|ROMANTIC IMAGES GIFT WRAP SET|32600
21822|GLITTER CHRISTMAS TREE WITH BELLS|32600
23581|JUMBO BAG PAISLEY PARK|41600
84818|DANISH ROSE PHOTO FRAME|17000
22694|WICKER STAR |42000
22652|TRAVEL SEWING KIT|33000
21980|PACK OF 12 RED RETROSPOT TISSUES |16600
84931A|PINK SCOTTIE DOG W FLOWER PATTERN|32600
21221|SET/4 BADGES CUTE CREATURES|25000
22269|EGG CUP NATURAL CHICKEN|25000
21841|BABY MOUSE RED GINGHAM DRESS|85000
23002|TRAVEL CARD WALLET SKULLS|8400
23055|IVORY CHANDELIER T-LIGHT HOLDER|125000
22909|SET OF 20 VINTAGE CHRISTMAS NAPKINS|17000
21905|MORE BUTTER METAL SIGN |42000
84536B|FAIRY CAKES NOTEBOOK A7 SIZE|8400
22400|MAGNETS PACK OF 4 HOME SWEET HOME|7800
84032A|CHARLIE+LOLA PINK HOT WATER BOTTLE|15800
85194L|HANGING SPRING FLOWER EGG LARGE|32600
22992|REVOLVER WOODEN RULER |33000
21015|DARK BIRD HOUSE TREE DECORATION|5800
84509B|SET OF 4 FAIRY CAKE PLACEMATS|65800
23031|DRAWER KNOB CRACKLE GLAZE PINK|33000
22372|AIRLINE BAG VINTAGE WORLD CHAMPION |165800
23353|6 GIFT TAGS VINTAGE CHRISTMAS |16600
23220|REINDEER HEART DECORATION GOLD|16600
21068|VINTAGE BILLBOARD LOVE/HATE MUG|25000
21163|DO NOT TOUCH MY STUFF DOOR HANGER |7800
22693|GROW A FLYTRAP OR SUNFLOWER IN TIN|25000
90058B|CRYSTAL STUD EARRINGS ASSORTED COL |7600
22398|MAGNETS PACK OF 4 SWALLOWS|7800
90187B|GREEN DROP EARRINGS W BEAD CLUSTER|66400
23075|PARLOUR CERAMIC WALL HOOK|75000
37475|SET/4 COLOURFUL MIXING BOWLS|199000
20973|12 PENCIL SMALL TUBE WOODLAND|13000
23570|TRADITIONAL PICK UP STICKS GAME |49200
23003|TRAVEL CARD WALLET VINTAGE ROSE |8400
82599|?|0
23210|WHITE ROCKING HORSE HAND PAINTED|25000
15044C|PURPLE PAPER PARASOL|59000
20675|BLUE POLKADOT BOWL|49200
23128|DOLLCRAFT BOY JEAN-PAUL |99000
23130|MISTLETOE HEART WREATH GREEN|165800
18097C|WHITE TALL PORCELAIN T-LIGHT HOLDER|51000
23010|CIRCUS PARADE BABY GIFT SET|339000
84906|PINK B'FLY C/COVER W BOBBLES|119000
20831|GOLD PHOTO FRAME|82600
20676|RED RETROSPOT BOWL|25000
85227|SET OF 6 3D KIT CARDS FOR KIDS|17000
23499|SET 12 VINTAGE DOILY CHALK |16600
23555|LANDMARK FRAME NOTTING HILL |219000
22437|SET OF 9 BLACK SKULL BALLOONS|17000
22087|PAPER BUNTING WHITE LACE|51000
23223|CHRISTMAS TREE HANGING SILVER |16600
23296|SET OF 6 TEA TIME BAKING CASES|25000
22244|3 HOOK HANGER MAGIC GARDEN|82600
84559b|3D SHEET OF CAT STICKERS|33800
22983|CARD BILLBOARD FONT|8400
72801c|4 ROSE PINK DINNER CANDLES|49200
85150|LADIES & GENTLEMEN METAL SIGN|51000
20707|CRAZY DAISY HEART DECORATION|16600
22770|MIRROR CORNICE|299000
21494|ROTATING LEAVES T-LIGHT HOLDER|115800
22123|PING MICROWAVE APRON|39000
21775|DECORATIVE FLORE BATHROOM BOTTLE|49200
22118|JOY WOODEN BLOCK LETTERS|232600
22306|SILVER MUG BONE CHINA TREE OF LIFE|21200
21316|SMALL CHUNKY GLASS ROMAN  BOWL|15800
23032|DRAWER KNOB CRACKLE GLAZE IVORY|33000
22566|FELTCRAFT HAIRBAND PINK AND PURPLE|17000
22049|WRAP CHRISTMAS SCREEN PRINT|3800
21313|GLASS HEART T-LIGHT HOLDER |17000
23244|ROUND STORAGE TIN VINTAGE LEAF|39000
21115|ROSE CARAVAN DOORSTOP|135000
85132A|CHARLIE + LOLA BISCUITS TINS|39000
23319|BOX OF 6 MINI 50'S CRACKERS|49800
22845|VINTAGE CREAM CAT FOOD CONTAINER|254400
22512|DOORSTOP RACING CAR DESIGN|75000
23000|TRAVEL CARD WALLET TRANSPORT|8400
22665|RECIPE BOX BLUE SKETCHBOOK DESIGN|132600
79063D|RETRO PILL BOX , REVOLUTIONARY|3800
21358|TOAST ITS - HAPPY BIRTHDAY|25000
21215|IVORY PAPER CUP CAKE CASES |25000
35924|HANGING FAIRY CAKE DECORATION|82600
85214|TUB 24 PINK FLOWER PEGS|33000
85167B|BLACK GRAND BAROQUE PHOTO FRAME|169400
21257|VICTORIAN SEWING BOX MEDIUM|322600
84997c|CHILDRENS CUTLERY POLKADOT BLUE|165800
22461|SAVOY ART DECO CLOCK|79000
85035C|ROSE 3 WICK MORRIS BOX CANDLE|25000
85025C|PINK HEART SHAPE PHOTO FRAME|33000
72807C|SET/3 VANILLA SCENTED CANDLE IN BOX|85000
85208|SET/12 FUNKY FELT FLOWER PEG IN BAG|42000
21238|RED RETROSPOT CUP|32600
20886|BOX OF 9 PEBBLE CANDLES|84200
21162|TOXIC AREA  DOOR HANGER |7800
22094|RED RETROSPOT TISSUE BOX|7800
22046|TEA PARTY  WRAPPING PAPER |8400
21671|RED SPOT CERAMIC DRAWER KNOB|25000
22399|MAGNETS PACK OF 4 CHILDHOOD MEMORY|25000
20748|KENSINGTON COFFEE SET|255000
22335|HEART DECORATION PAINTED ZINC |13000
23110|PARISIENNE KEY CABINET |115000
21442|GREEN BIRDHOUSE DECORATION|17000
35972|DAISY FOLKART HEART DECORATION|25000
22251|BIRDHOUSE DECORATION MAGIC GARDEN|25000
85062|PEARL CRYSTAL PUMPKIN T-LIGHT HLDR|33000
21845|DAIRY MAID STRIPE MUG|15800
22080|RIBBON REEL POLKADOTS |33000
22315|200 RED + WHITE BENDY STRAWS|25000
22640|SET OF 4 NAPKIN CHARMS 3 KEYS |51000
22815|CARD PSYCHEDELIC APPLES|8400
22683|FRENCH BLUE METAL DOOR SIGN 8|25000
21967|PACK OF 12 SKULL TISSUES|5800
82613A|METAL SIGN,CUPCAKE SINGLE HOOK|49200
22250|DECORATION  BUTTERFLY  MAGIC GARDEN|17000
20966|SANDWICH BATH SPONGE|49200
23546|WRAP PAISLEY PARK |8400
82616C|MIDNIGHT GLAMOUR SCARF KNITTING KIT|59000
20652|BLUE POLKADOT LUGGAGE TAG |16600
22451|SILK PURSE BABUSHKA RED|67000
84828|JUNGLE POPSICLES ICE LOLLY HOLDERS|49200
23217|LAUREL HEART ANTIQUE SILVER|25000
23512|EMBROIDERED RIBBON REEL ROSIE|41600
22913|RED COAT RACK PARIS FASHION|99000
22729|ALARM CLOCK BAKELIKE ORANGE|75000
22688|DOORMAT PEACE ON EARTH BLUE|165000
22215|CAKE STAND WHITE TWO TIER LACE|59000
22434|BALLOON PUMP WITH 10 BALLOONS|39000
21082|SET/20 FRUIT SALAD PAPER NAPKINS |32600
21706|FOLDING UMBRELLA RED/WHITE POLKADOT|99000
23125|6PC WOOD PLATE SET DISPOSABLE|49200
21403|BLUE EGG  SPOON|8400
21902|KEY FOB , FRONT  DOOR |13000
22273|FELTCRAFT DOLL MOLLY|115800
23252|VINTAGE RED ENAMEL TRIM JUG |75000
22753|SMALL YELLOW BABUSHKA NOTEBOOK |17000
85015|SET OF 12  VINTAGE POSTCARD SET|49200
22798|ANTIQUE GLASS DRESSING TABLE POT|59000
22897|OVEN MITT APPLES DESIGN|29000
22814|CARD PARTY GAMES |8400
22860|EASTER TIN CHICKS PINK DAISY|65800
84951B|SET OF 4 BLACK LOVEBIRD COASTERS|49200
23412|HEART MIRROR ANTIQUE WHITE|150000
84947|ANTIQUE SILVER TEA GLASS ENGRAVED|25000
85114C|RED ENCHANTED FOREST PLACEMAT|33000
22581|WOOD STOCKING CHRISTMAS SCANDISPOT|5800
85036C|ROSE 1 WICK MORRIS BOXED CANDLE|85000
16161G|WRAP BAD HAIR DAY|2000
22301|COFFEE MUG CAT + BIRD DESIGN|51000
22314|OFFICE MUG WARMER CHOC+BLUE|59000
23247|BISCUIT TIN 50'S CHRISTMAS|57800
79067|CORONA MEXICAN TRAY|75000
21026|SPACE OWL|25000
DCGSSGIRL|GIRLS PARTY BAG|65800
22660|DOORMAT I LOVE LONDON|288600
22152|PLACE SETTING WHITE STAR|32600
22565|FELTCRAFT HAIRBANDS PINK AND WHITE |32600
22121|NOEL WOODEN BLOCK LETTERS |119000
21682|LARGE MEDINA STAMPED METAL BOWL |199200
23112|PARISIENNE CURIO CABINET|150000
21626|VINTAGE UNION JACK PENNANT|39000
23360|SET 8 CANDLES VINTAGE DOILY|39000
37479P|CUBIC MUG FLOCK PINK ON BROWN|7800
23121|PACK OF 6 COCKTAIL PARASOL STRAWS|8400
47580|TEA TIME DES TEA COSY|51000
22509|SEWING BOX RETROSPOT DESIGN |79000
22105|MIRROR MOSAIC GOBLET CANDLE HOLDER|85000
84944|SET OF 6 KASHMIR FOLKART BAUBLES|33000
22092|BLUE PAISLEY TISSUE BOX|7800
23133|LARGE IVORY HEART WALL ORGANISER|332600
22396|MAGNETS PACK OF 4 RETRO PHOTO|7800
37370|RETRO COFFEE MUGS ASSORTED|322600
21675|BUTTERFLIES STICKERS|33200
23039|T-LIGHT HOLDER SILVER HEART HANDLE|82600
84673B|BLUE FLY SWAT|15800
85231B|CINAMMON SET OF 9 T-LIGHTS|32600
22598|CHRISTMAS MUSICAL ZINC TREE|16600
21245|GREEN POLKADOT PLATE |33800
84984D|ORIENTAL RED CUSHION COVER |93000
22041|RECORD FRAME 7" SINGLE SIZE |51000
21463|MIRRORED DISCO BALL |99000
90059A|DIAMANTE HAIR GRIP PACK/2 CRYSTAL|33000
23579|SNACK TRAY I LOVE LONDON|39000
21207|SKULL AND CROSSBONES  GARLAND |33000
47421|ASSORTED COLOUR LIZARD SUCTION HOOK|7200
90033|IVORY SHELL HEART EARRINGS|51000
21059|PARTY INVITES DINOSAURS|17000
23583|LUNCH BAG PAISLEY PARK  |33000
85127|SMALL SQUARE CUT GLASS CANDLESTICK|199200
22475|SKULL DESIGN TV DINNER TRAY|220400
20762|GREEN FERN SKETCHBOOK |75000
21001|ROSE DU SUD WASHBAG |82600
20760|GARDEN PATH POCKET BOOK|17000
22682|FRENCH BLUE METAL DOOR SIGN 7|25000
21462|NURSERY A,B,C PAINTED LETTERS|265800
82001s|SILVER RECORD COVER FRAME|149200
47503A|ASS FLORAL PRINT MULTI SCREWDRIVER|8400
72800B| 4 PURPLE FLOCK DINNER CANDLES|51000
23481|PEARLISED IVORY HEART SMALL |25000
23365|SET 12 COLOUR PENCILS LOVE LONDON|13000
23169|CLASSIC GLASS COOKIE JAR|83000
21744|SNOWFLAKE PORTABLE TABLE LIGHT |59000
22344|PARTY PIZZA DISH PINK POLKADOT|17000
85169A|IVORY LOVE BIRD CANDLE|25000
22763|KEY CABINET MA CAMPAGNE|199000
22930|BAKING MOULD HEART MILK CHOCOLATE|51000
84465|15 PINK FLUFFY CHICKS IN BOX|59000
84813|SET OF 4 DIAMOND NAPKIN RINGS|499200
85039A|SET/4 RED MINI ROSE CANDLE IN BOWL|33000
90165B|WHITE ROSEBUD  PEARL EARRINGS|49600
20763|DAISY SKETCHBOOK |75000
23467|VINTAGE ZINC PLANTER  |125000
35599B|BLACK CHRISTMAS TREE 120CM|39000
22919|HERB MARKER MINT|13000
22997|TRAVEL CARD WALLET UNION JACK|16600
71270|PHOTO CLIP LINE|25000
72760B|VINTAGE CREAM 3 BASKET CAKE STAND|415800
22944|CHRISTMAS METAL POSTCARD WITH BELLS|25000
35911A|MULTICOLOUR RABBIT EGG WARMER|16600
22147|FELTCRAFT BUTTERFLY HEARTS|29000
21466|RED FLOWER CROCHET FOOD COVER|75000
22025|RING OF ROSES BIRTHDAY CARD|8400
85130C|BEADED CRYSTAL HEART BLUE  LARGE|15800
20757|RED DAISY POCKET BOOK |17000
22799|SWEETHEART WIRE FRUIT BOWL|170000
23107|WHITE HEARTS WIRE PLANT POT HOLDER|57800
71279|PINK GLASS CANDLEHOLDER|59000
22668|PINK BABY BUNTING|115800
84499|BLACK FLOWER CANDLE PLATE|17000
22310|IVORY KNITTED MUG COSY |67200
22892|SET OF SALT AND PEPPER TOADSTOOLS|25000
22260|FELT EGG COSY BLUE RABBIT |32600
47593B|SCOTTIE DOGS BABY BIB|16600
22530|MAGIC DRAWING SLATE DOLLY GIRL |8400
84846A|SCENTED CANDLE IN DIGITALIS TIN|42000
22745|POPPY'S PLAYHOUSE BEDROOM |65800
21723|ALPHABET HEARTS STICKER SHEET|32600
22700|BLACK AND WHITE DOG BOWL|33600
22214|CANDLE PLATE LACE WHITE|32600
21067|VINTAGE RED TEATIME MUG|25000
21984|PACK OF 12 PINK PAISLEY TISSUES |17000
22247|BUNNY DECORATION MAGIC GARDEN|17000
22762|CUPBOARD 3 DRAWER MA CAMPAGNE|299000
21584|RETROSPOT SMALL TUBE MATCHES|33000
22021|BLUE FELT EASTER EGG BASKET|65800
23140|TRIPLE WIRE HOOK IVORY HEART|83000
22297|HEART IVORY TRELLIS SMALL|25000
20618|QUEEN OF THE SKIES PASSPORT COVER |33200
22257|FELT FARM ANIMAL SHEEP|25000
82582|AREA PATROLLED METAL SIGN|42000
37447|CERAMIC CAKE DESIGN SPOTTED PLATE|65800
84313C||0
23434|3 RAFFIA RIBBONS 50'S CHRISTMAS |15800
22939|APRON APPLE DELIGHT|99000
22809|SET OF 6 T-LIGHTS SANTA|59000
23114|VINTAGE LEAF CHOPPING BOARD  |99000
90083|CRYSTAL CZECH CROSS PHONE CHARM|32600
22246|MAGIC GARDEN FELT GARLAND |82600
22201|FRYING PAN BLUE POLKADOT|85000
22525|CHILDRENS GARDEN GLOVES PINK|0
22412|METAL SIGN NEIGHBOURHOOD WITCH |42000
21947|SET OF 6 HEART CHOPSTICKS|49200
22713|CARD I LOVE LONDON |8400
21636|MADRAS NOTEBOOK MEDIUM|15000
23576|SNACK TRAY RED VINTAGE DOILY|39000
22249|DECORATION WHITE CHICK MAGIC GARDEN|17000
22052|VINTAGE CARAVAN GIFT WRAP|8400
21917|SET 12 KIDS  WHITE CHALK STICKS|8400
22270|HAPPY EASTER HANGING DECORATION|75000
22927|GREEN GIANT GARDEN THERMOMETER|119000
23215|JINGLE BELL HEART ANTIQUE SILVER|41600
22982|PANTRY PASTRY BRUSH|25000
23176|ABC TREASURE BOOK BOX |45000
22332|SKULLS PARTY BAG + STICKER SET|33000
22562|MONSTERS STENCIL CRAFT|25000
85049D|BRIGHT BLUES RIBBONS |25000
84279P|CHERRY BLOSSOM  DECORATIVE FLASK|169400
21588|RETROSPOT GIANT TUBE MATCHES|51000
23339|EGG FRYING PAN BLUE |41600
21383|PACK OF 12 STICKY BUNNIES|13000
21135|VICTORIAN  METAL POSTCARD SPRING|33800
23194|GYMKHANA TREASURE BOOK BOX|91600
23117|POPPY FIELDS CHOPPING BOARD|99000
46776E|WOVEN CANDY CUSHION COVER |82600
47563A|RETRO LONGBOARD IRONING BOARD COVER|65800
23413|VINTAGE COFFEE GRINDER BOX|215800
22252|BIRDCAGE DECORATION TEALIGHT HOLDER|25000
23323|WHITE WICKER STAR |42000
85049e|SCANDINAVIAN REDS RIBBONS|65800
23159|SET OF 5 PANCAKE DAY MAGNETS|41600
22608|PENS ASSORTED FUNKY JEWELED |8400
22057|CERAMIC PLATE STRAWBERRY DESIGN|29800
79030G|TUMBLER NEW ENGLAND|7800
23569|TRADTIONAL ALPHABET STAMP SET|99000
21824|PAINTED METAL STAR WITH HOLLY BELLS|16600
23171|REGENCY TEA PLATE GREEN |33000
20984|12 PENCILS TALL TUBE POSY|5800
22957|SET 3 PAPER VINTAGE CHICK PAPER EGG|59000
20956|PORCELAIN T-LIGHT HOLDERS ASSORTED|25000
21071|VINTAGE BILLBOARD DRINK ME MUG|49200
22771|CLEAR DRAWER KNOB ACRYLIC EDWARDIAN|25000
23089|GLASS BON BON JAR|65800
22331|WOODLAND PARTY BAG + STICKER SET|33000
21098|CHRISTMAS TOILET ROLL|49200
90022|EDWARDIAN DROP EARRINGS JET BLACK|76200
85034B|3 WHITE CHOC MORRIS BOXED CANDLES|25000
22538|MINI JIGSAW GO TO THE FAIR|8400
21332|MOROCCAN BEATEN METAL MIRROR|255000
22859|EASTER TIN BUNNY BOUQUET|33000
22810|SET OF 6 T-LIGHTS SNOWMEN|59000
21088|SET/6 FRUIT SALAD PAPER CUPS|16600
23163|REGENCY SUGAR TONGS|41600
84660C|PINK STITCHED WALL CLOCK|15800
23017|APOTHECARY MEASURING JAR|223000
22899|CHILDREN'S APRON DOLLY GIRL |42000
46000M|POLYESTER FILLER PAD 45x45cm|31000
21913|VINTAGE SEASIDE JIGSAW PUZZLES|75000
35809A|ENAMEL PINK TEA CONTAINER|16600
23393|HOME SWEET HOME CUSHION COVER |75000
47504K|ENGLISH ROSE GARDEN SECATEURS|15800
21656|RIDGED GLASS POSY VASE |29000
23514|EMBROIDERED RIBBON REEL SALLY |41600
23087|ZINC  HEART T-LIGHT HOLDER|25000
47574A|ENGLISH ROSE SCENTED HANGING FLOWER|15000
46000R|POLYESTER FILLER PAD 45x30cm|29000
84970L|SINGLE HEART ZINC T-LIGHT HOLDER|19000
85124B|BLUE JUICY FRUIT PHOTO FRAME|51000
22487|WHITE WOOD GARDEN PLANT LADDER|399200
21916|SET 12 RETRO WHITE CHALK STICKS|16200
22262|FELT EGG COSY CHICKEN|17000
22204|MILK PAN BLUE POLKADOT|65800
23377|PACK OF 12 DOLLY GIRL TISSUES|16600
20897|VINTAGE NOTEBOOK PARIS DAYS|49200
16008|SMALL FOLDING SCISSOR(POINTED EDGE)|2400
21198|WHITE HEART CONFETTI IN TUBE|33000
21445|12 PINK ROSE PEG PLACE SETTINGS|25000
22680|FRENCH BLUE METAL DOOR SIGN 5|49200
84660A|WHITE STITCHED WALL CLOCK|25000
90209B|GREEN ENAMEL+GLASS HAIR COMB|41400
22241|GARLAND WOODEN HAPPY EASTER|49200
90152B|BLUE/GREEN SHELL NECKLACE W PENDANT|119000
23333|IVORY WICKER HEART MEDIUM|49200
21467|CHERRY CROCHET FOOD COVER|152400
21807|WHITE CHRISTMAS STAR DECORATION|8400
23271|CHRISTMAS TABLE SILVER CANDLE SPIKE|16600
35921|EASTER BUNNY HANGING GARLAND|25000
21243|PINK  POLKADOT PLATE |33800
23093|SMALL PARISIENNE HEART PHOTO FRAME |49800
22148|EASTER CRAFT 4 CHICKS |39000
23240|SET OF 4 KNICK KNACK TINS DOILEY |83000
22312|OFFICE MUG WARMER POLKADOT|115800
23417|BATHROOM HOOK|7800
22760|TRAY, BREAKFAST IN BED|255000
23101|SILVER STARS TABLE DECORATION|16600
84031A|CHARLIE+LOLA RED HOT WATER BOTTLE |84200
22537|MAGIC DRAWING SLATE DINOSAUR|8400
22408|MONEY BOX CONFECTIONERY DESIGN|49200
21195|PINK  HONEYCOMB PAPER BALL |42000
22072|RED RETROSPOT TEA CUP AND SAUCER |75000
22406|MONEY BOX KINGS CHOICE DESIGN|25000
22940|FELTCRAFT CHRISTMAS FAIRY|85000
22425|ENAMEL COLANDER CREAM|199200
72807A|SET/3 ROSE CANDLE IN JEWELLED BOX|85000
23346|SPACEBOY BEAKER|25000
20766|GARDEN PATH SKETCHBOOK|75000
22302|COFFEE MUG PEARS  DESIGN|51000
90028|NEW BAROQUE LARGE NECKLACE BLK/WHIT|166400
22719|GUMBALL MONOCHROME COAT RACK|49200
22129|PARTY CONES CANDY TREE DECORATION|17000
21591|COSY HOUR CIGAR BOX MATCHES |25000
23027|DRAWER KNOB VINTAGE GLASS HEXAGON|41600
15044A|PINK PAPER PARASOL |59000
90214R|LETTER "R" BLING KEY RING|16600
21278|VINTAGE KITCHEN PRINT PUDDINGS|51000
84849B|FAIRY SOAP SOAP HOLDER|33800
22949|36 DOILIES DOLLY GIRL|29000
84509c|SET OF 4 POLKADOT PLACEMATS |149200
84580|MOUSE TOY WITH PINK T-SHIRT|75000
22796|PHOTO FRAME 3 CLASSIC HANGING|199000
22959|WRAP CHRISTMAS VILLAGE|8400
21012|ANTIQUE ALL GLASS CANDLESTICK|42000
23372|SET 36 COLOUR PENCILS DOLLY GIRL|25000
85048|15CM CHRISTMAS GLASS BALL 20 LIGHTS|159000
21270|ANTIQUE CREAM CUTLERY CUPBOARD|499200
21190|PINK HEARTS PAPER GARLAND|33000
17012D|ORIGAMI ROSE INCENSE/CANDLE SET |17000
22353|LUNCH BOX WITH CUTLERY FAIRY CAKES |51000
22220|CAKE STAND LOVEBIRD 2 TIER WHITE|399200
21622|VINTAGE UNION JACK CUSHION COVER|99000
84920|PINK FLOWER FABRIC PONY|75000
84685|BEACH HUT KEY CABINET|75000
22716|CARD CIRCUS PARADE|8400
23451|SQUARE MINI PORTRAIT FRAME|39000
23483|HANGING  BUTTERFLY T-LIGHT HOLDER|25000
22800|ANTIQUE TALL SWIRLGLASS TRINKET POT|75000
23225|CHERUB HEART DECORATION SILVER |32600
23081|GREEN METAL BOX ARMY SUPPLIES|150000
72800F||0
23551|PACK OF 12 PAISLEY PARK TISSUES |7800
22248|DECORATION  PINK CHICK MAGIC GARDEN|17000
22515|CHILDS GARDEN SPADE PINK|42000
21972|SET OF 36 DINOSAUR PAPER DOILIES|29000
21408|SPOTTY PINK DUCK DOORSTOP|39000
22894|TABLECLOTH RED APPLES DESIGN |199000
85183B|CHARLIE & LOLA WASTEPAPER BIN FLORA|152400
23548|WRAP MAGIC FOREST |8400
84989a|75 GREEN FAIRY CAKE CASES|42600
23158|SET OF 5 LUCKY CAT MAGNETS |82600
22597|MUSICAL ZINC HEART DECORATION |17000
21028|NINJA RABBIT BLACK|49200
22340|NOEL GARLAND PAINTED ZINC |7800
22941|CHRISTMAS LIGHTS 10 REINDEER|170000
21208|PASTEL COLOUR HONEYCOMB FAN|33000
23316|RED REFECTORY CLOCK |199000
82011A|BATHROOM SCALES, TROPICAL BEACH|75000
22932|BAKING MOULD TOFFEE CUP CHOCOLATE|42000
22870|NUMBER TILE COTTAGE GARDEN 2|39000
22985|WRAP BILLBOARD FONTS DESIGN|8400
22217|T-LIGHT HOLDER HANGING LACE|49200
21948|SET OF 6 CAKE CHOPSTICKS|25000
22480|RED TEA TOWEL CLASSIC DESIGN|25000
22673|FRENCH GARDEN SIGN BLUE METAL|25000
21390|FILIGRIS HEART WITH BUTTERFLY|25000
23422|PANTRY HOOK BALLOON WHISK |41600
21259|VICTORIAN SEWING BOX SMALL |249200
22975|SPACEBOY CHILDRENS EGG CUP|25000
84228|HEN HOUSE W CHICK STANDING|8400
23131|MISELTOE HEART WREATH WHITE|75000
23150|IVORY SWEETHEART SOAP DISH|99200
35915B|BLUE KNITTED HEN |33000
21161||0
23066|SMALL DECO JEWELLERY STAND|165000
23122|PARTY CHARMS 50 PIECES|16600
10135|COLOURING PENCILS BROWN TUBE|49200
84843|WHITE SOAP RACK WITH 2 BOTTLES|119000
46776B|WOVEN BERRIES CUSHION COVER |99000
21456|2 PICTURE BOOK EGGS EASTER CHICKS|25000
22419|LIPSTICK PEN RED|17000
84792|ENCHANTED BIRD COATHANGER 5 HOOK|93000
20839|FRENCH PAISLEY CUSHION COVER |65800
22339|CHRISTMAS TREE PAINTED ZINC |3800
23398|HANGING HEART BONHEUR|17000
35810A|ENAMEL PINK COFFEE CONTAINER|16600
23552|BICYCLE PUNCTURE REPAIR KIT |41600
22360|GLASS JAR ENGLISH CONFECTIONERY|115800
84997B|RED 3 PIECE RETROSPOT CUTLERY SET|75000
23366|SET 12 COLOURING PENCILS DOILY|25000
23536|WALL ART VILLAGE SHOW |119000
21311|SET/4 BIRD MIRROR MAGNETS |5800
22514|CHILDS GARDEN SPADE BLUE|42000
22103|MIRROR MOSAIC T-LIGHT HOLDER ROUND|33000
85093|CANDY SPOT EGG WARMER HARE|7800
23423|PANTRY 3 HOOK ROLLING PIN HANGER|75000
22108|PING! MICROWAVE PLATE|25000
22099|CARAVAN SQUARE TISSUE BOX|7800
22165|DIAMANTE HEART SHAPED WALL MIRROR, |220400
23392|SPACEBOY ROCKET LOLLY MAKERS|82600
84569B|PACK 3 FIRE ENGINE/CAR PATCHES|25000
22376|AIRLINE BAG VINTAGE JET SET WHITE|85000
71477|COLOURED GLASS STAR T-LIGHT HOLDER|65800
22856|ASSORTED EASTER DECORATIONS  BELLS|25000
84559A|3D SHEET OF DOG STICKERS|32600
47369A|PINK GREEN EMBROIDERY COSMETIC BAG|115800
21770|OPEN CLOSED METAL SIGN|99000
21724|PANDA AND BUNNIES STICKER SHEET|17000
22334|DINOSAUR PARTY BAG + STICKER SET|29000
72801d|4 SKY BLUE DINNER CANDLES|49200
22096|PINK PAISLEY SQUARE TISSUE BOX |7800
20830|SILVER PHOTO FRAME|82600
20971|PINK BLUE FELT CRAFT TRINKET BOX|50200
84660B|BLACK STITCHED WALL CLOCK|25000
22403|MAGNETS PACK OF 4 VINTAGE LABELS |7800
84687|BEACH HUT SHELF W 3 DRAWERS|119000
23233|WRAP POPPIES  DESIGN|8400
23143|ZINC WIRE KITCHEN ORGANISER|208000
22325|MOBILE VINTAGE HEARTS |99000
22900|SET 2 TEA TOWELS I LOVE LONDON |55000
23401|RUSTIC MIRROR WITH LACE HEART|125000
81950B|FLOWER BLUE CLOCK WITH SUCKER|5800
23090|VINTAGE GLASS T-LIGHT HOLDER|16600
22559|SEASIDE FLYING DISC|49200
20619|TROPICAL PASSPORT COVER |32600
22852|DOG BOWL VINTAGE CREAM|85000
72799E|IVORY PILLAR CANDLE SILVER FLOCK|65800
21955|DOORMAT UNION JACK GUNS AND ROSES|91600
21758|VINTAGE SHELLS PRINT|129000
21469|POLKA DOT RAFFIA FOOD COVER|75000
23373|VINTAGE CHRISTMAS PAPER GIFT BAG|16400
84804A|CREAM DELPHINIUM ARTIFICIAL FLOWER|59000
18094C|WHITE AND BLUE CERAMIC OIL BURNER|49200
84030e|ENGLISH ROSE HOT WATER BOTTLE|182600
23636|SET 10 CARDS WISHING TREE 17116|58200
23501|KEY RING BASEBALL BOOT UNION JACK|25000
21172|PARTY METAL SIGN |29000
84929|ASSTD FRUIT+FLOWERS FRIDGE MAGNETS|3800
21224|SET/4 SKULL BADGES|16600
23564|EGG CUP MILKMAID INGRID|49200
21205|MULTICOLOUR 3D BALLS GARLAND|51000
22838|3 TIER CAKE TIN RED AND CREAM|299000
84497||0
22813|PACK 3 BOXES BIRD PANNETONE |39000
22313|OFFICE MUG WARMER PINK|59000
22032|BOTANICAL LILY GREETING CARD|16600
21918|SET 12 KIDS COLOUR  CHALK STICKS|16600
85104|SILVER GLASS T-LIGHT SET|51000
BANK CHARGES|Bank Charges|3e+05
85230F|JASMINE VOTIVE CANDLE|5800
16258A|SWIRLY CIRCULAR RUBBERS IN BAG|8400
21881|CUTE CATS TAPE|8400
16045|POPART WOODEN PENCILS ASST|800
21711|FOLDING UMBRELLA WHITE/RED POLKADOT|99000
85187|S/12 MINI RABBIT EASTER|33000
23420|PANTRY HOOK TEA STRAINER |41600
85049g|CHOCOLATE BOX RIBBONS |49200
22896|PEG BAG APPLES DESIGN|51000
20684|STRAWBERRY DREAM CHILDS UMBRELLA|135400
23547|WRAP FLOWER SHOP  |8400
20653|CHERRY BLOSSOM LUGGAGE TAG|17000
23265|SET OF 3 WOODEN TREE DECORATIONS|25000
21206|STRAWBERRY HONEYCOMB  GARLAND |33000
21391|FRENCH LAVENDER SCENT HEART|15000
21620|SET OF 4 ROSE BOTANICAL CANDLES|25000
23459|DOLLY CABINET 2 DRAWERS |250000
22098|BOUDOIR SQUARE TISSUE BOX|49200
85172|HYACINTH BULB T-LIGHT CANDLES|8400
72132|COLUMBIAN CUBE CANDLE|39000
22119|PEACE WOODEN BLOCK LETTERS|39000
21821|GLITTER STAR GARLAND WITH BELLS |75000
23403|LETTER HOLDER HOME SWEET HOME|75000
23568|EGG CUP HENRIETTA HEN CREAM |25000
21157|RED RETROSPOT WASHBAG|42000
20679|EDWARDIAN PARASOL RED|119000
20616|CHERRY BLOSSOM PASSPORT COVER|15000
22488|NATURAL SLATE RECTANGLE CHALKBOARD|33000
21249|WOODLAND  HEIGHT CHART STICKERS |59000
85019B|BLOSSOM  IMAGES NOTEBOOK SET|49200
21847|GREEN  DIAMANTE PEN IN GIFT BOX|99000
23096|PETIT TRAY CHIC|33000
20934|SET/3 POT PLANT CANDLES|215800
90161C|ANT COPPER LIME BOUDICCA BRACELET|99600
84905|PINK BUTTERFLY CUSHION COVER |99200
47310M|SMALL POP BOX FUNKY MONKEY|32600
82494l|WOODEN FRAME ANTIQUE WHITE |165800
23065|LARGE DECO JEWELLERY STAND|499200
47590b|PINK HAPPY BIRTHDAY BUNTING|215800
85185B|PINK HORSE SOCK PUPPET|59000
22395|PAPERWEIGHT VINTAGE PAISLEY|51000
23214|JINGLE BELL HEART ANTIQUE GOLD|41600
22755|SMALL PURPLE BABUSHKA NOTEBOOK |17000
22504|CABIN BAG VINTAGE RETROSPOT|599000
84923|PINK BUTTERFLY HANDBAG W BOBBLES|82600
23421|PANTRY HOOK SPATULA|82600
22740|POLKADOT PEN|17000
17003|BROCADE RING PURSE |7800
22564|ALPHABET STENCIL CRAFT|25000
85054|FRENCH ENAMEL POT W LID|59000
22988|SOLDIERS EGG CUP |25000
22342|HOME GARLAND PAINTED ZINC |15000
23040|PAPER LANTERN 9 POINT SNOW STAR |115000
20733|GOLD MINI TAPE MEASURE |16600
85061W|WHITE JEWELLED HEART DECORATION|32600
23118|PARISIENNE JEWELLERY DRAWER |150000
21537|RED RETROSPOT PUDDING BOWL|85000
37468|HARDMAN MUG 3 ASSORTED|7800
23525|BUFFALO BILL WALL ART |65800
23148|MINIATURE ANTIQUE ROSE HOOK IVORY|16600
90200D|PINK SWEETHEART BRACELET|83000
84870B|BLUE GEISHA GIRL |75000
20756|GREEN FERN POCKET BOOK|17000
84559a|3D SHEET OF DOG STICKERS|33200
22703|PINK CAT BOWL|32600
84031B|CHARLIE LOLA BLUE HOT WATER BOTTLE |82600
15039|SANDALWOOD FAN|32600
21872|GLAMOROUS  MUG|25000
22203|MILK PAN RED RETROSPOT|25000
16156S|WRAP PINK FAIRY CAKES |8400
22272|Damaged|0
23407|SET OF 2 TRAYS HOME SWEET HOME|199000
21880|RED RETROSPOT TAPE|8400
22258|FELT FARM ANIMAL RABBIT|25000
21669|BLUE STRIPE CERAMIC DRAWER KNOB|25000
72817|SET OF 2 CHRISTMAS DECOUPAGE CANDLE|32600
22548|HEADS AND TAILS SPORTING FUN|25000
21129|SILVER FISHING GNOME |249200
22362|GLASS JAR PEACOCK BATH SALTS|59000
22516|CHILDS GARDEN RAKE BLUE|42000
23106|ZINC HEARTS PLANT POT HOLDER|57800
84870C|GREEN GEISHA GIRL |75000
23226|FILIGREE HEART DAISY WHITE|49200
