21397|BLUE POLKADOT EGG CUP |7800
78034B|BLUE NETTING STORAGE HANGER|39000
85099F|JUMBO BAG STRAWBERRY|41600
22808|SET OF 6 T-LIGHTS EASTER CHICKS|59000
23299|FOOD COVER WITH BEADS SET 2 |67800
22782|SET 3 WICKER STORAGE BASKETS |499000
22521|CHILDS GARDEN TROWEL PINK|17000
22453|MEASURING TAPE BABUSHKA BLUE|51000
22120|WELCOME  WOODEN BLOCK LETTERS|199000
20770|ABSTRACT CIRCLE JOURNAL |49200
16054|POPART RECT PENCIL SHARPENER ASST|2400
84510c|SET OF 4 POLKADOT COASTERS|49200
22701|PINK DOG BOWL|59000
21123|SET/10 IVORY POLKADOT PARTY CANDLES|25000
84803B|WHITE ALLIUM  ARTIFICIAL FLOWER|33800
23283|DOORMAT VINTAGE LEAVES DESIGN |135000
21809|CHRISTMAS HANGING TREE WITH BELL|50200
23493|VINTAGE DOILY TRAVEL SEWING KIT|39000
23539|WALL ART LOVES' SECRET |119000
46000S|POLYESTER FILLER PAD 40x40cm|29000
23060|HEART BEADED TRELLIS DECORATION|41600
23474|WOODLAND SMALL BLUE FELT HEART|16600
22929|SCHOOL DESK AND CHAIR |1300000
90038A|GLASS AND PAINTED BEADS BRACELET TO|74600
90214B|LETTER "B" BLING KEY RING|16600
84821|DANISH ROSE DELUXE COASTER|17000
22829|SWEETHEART WIRE WALL TIDY|199000
85169C|EAU DE NIL LOVE BIRD CANDLE|25000
21804|dotcom|0
22232|JIGSAW TOADSTOOLS 3 PIECE|11800
23255|CHILDRENS CUTLERY CIRCUS PARADE|83000
46776F|WOVEN ROSE GARDEN CUSHION COVER |82600
23495|SET OF 3 PANTRY WOODEN SPOONS|25000
85049F|BABY BOOM RIBBONS |25000
23067|HANGING ENGRAVED METAL HEART|83000
23160|REGENCY TEA SPOON|25000
22279|POCKET BAG BLUE PAISLEY RED SPOT|49200
23469|CARD HOLDER LOVE BIRD SMALL|83000
84683|CLASSICAL ROSE CANDLESTAND|50200
84806A|PINK CANDYSTUFT ARTIFICIAL FLOWER|7800
20983|12 PENCILS TALL TUBE RED RETROSPOT|17000
85114c|RED ENCHANTED FOREST PLACEMAT|65800
21714|CITRONELLA CANDLE GARDEN POT|25000
22242|5 HOOK HANGER MAGIC TOADSTOOL|33000
23235|STORAGE TIN VINTAGE LEAF|57800
21680|WOODLAND  STICKERS|33200
21351|CINAMMON & ORANGE WREATH|135000
22175|PINK OWL SOFT TOY|59000
23340|VINTAGE CHRISTMAS CAKE FRILL|33000
85188A|GREEN METAL SWINGING BUNNY|17000
23609|SET 10 CARDS SNOWY ROBIN 17099|58200
22902|TOTE BAG I LOVE LONDON|82600
22831|WHITE BROCANTE SOAP DISH|115800
35004C|SET OF 3 COLOURED  FLYING DUCKS|109000
90019B|GOLD M.O.P ORBIT BRACELET|108000
35095B|RED VICTORIAN FABRIC OVAL BOX|16800
22545|MINI JIGSAW BUNNIES|7200
22477|WATERING CAN GARDEN MARKER|25000
23189|SET OF 12 FORK CANDLES|57800
90214K|LETTER "K" BLING KEY RING|16600
22543|MINI JIGSAW BAKE A CAKE |17000
21903|MAN FLU METAL SIGN|42000
22062||0
21708|FOLDING UMBRELLA CREAM POLKADOT|99000
22496|SET OF 2 ROUND TINS DUTCH CHEESE|15800
22223|CAKE PLATE LOVEBIRD PINK|199200
20903|VINTAGE KEEPSAKE BOX TRAVELOGUE|127000
84531B|BLUE KNITTED EGG COSY|39000
22991|GIRAFFE WOODEN RULER|39000
18098C|PORCELAIN BUTTERFLY OIL BURNER|51000
85039B|S/4 IVORY MINI ROSE CANDLE IN BOWL|32600
23016|GLASS TWIST BON BON JAR|157000
84796A|PINK HAWAIIAN PICNIC HAMPER FOR 2|165800
16238|PARTY TIME PENCIL ERASERS|8400
21402|RED  EGG  SPOON|2400
72351B|SET/6 PINK  BUTTERFLY T-LIGHTS|42000
22605|WOODEN CROQUET GARDEN SET|299000
17165D|ASS COL LARGE SAND FROG P'WEIGHT|21000
15056n|EDWARDIAN PARASOL NATURAL|249200
84745A|PINK HANGING GINGHAM EASTER HEN|8400
23519|EMBROIDERED RIBBON REEL CLAIRE|149200
22192|BLUE DINER WALL CLOCK|170000
84993a|75 GREEN PETIT FOUR CASES|16600
23427|STOOL HOME SWEET HOME |250000
35923|CANDY HEART HANGING DECORATION|7800
23550|WRAP ALPHABET POSTER  |8400
21866|UNION JACK FLAG LUGGAGE TAG|65800
23078|ICE CREAM PEN LIP GLOSS |25000
21640|ASSORTED TUTTI FRUTTI  FOB NOTEBOOK|32600
84507B|STRIPES DESIGN MONKEY DOLL|51000
22529|MAGIC DRAWING SLATE GO TO THE FAIR |16600
22599|CHRISTMAS MUSICAL ZINC STAR|17000
17107D|FLOWER FAIRY 5 DRAWER LINERS|51000
21618|4 WILDFLOWER BOTANICAL CANDLES|65800
22337|ANGEL DECORATION PAINTED ZINC |13000
22772|PINK DRAWER KNOB ACRYLIC EDWARDIAN|49200
15056bl|EDWARDIAN PARASOL BLACK|249200
23500|KEY RING BASEBALL BOOT ASSORTED |25000
21949|SET OF 6 STRAWBERRY CHOPSTICKS|25000
47504H|ENGLISH ROSE SPIRIT LEVEL |15800
20781|GOLD EAR MUFF HEADPHONES|109800
23381|PACK OF 12 VINTAGE LEAF TISSUES |16600
23338|EGG FRYING PAN RED |41600
15058B|PINK POLKADOT GARDEN PARASOL|159000
23183|MOTHER'S KITCHEN SPOON REST |149200
47503J|SET/3 FLORAL GARDEN TOOLS IN BAG|159000
23236|DOILEY STORAGE TIN|57800
23320|GIANT 50'S CHRISTMAS CRACKER|57800
21446|12 RED ROSE PEG PLACE SETTINGS|49200
21065|BOOM BOX SPEAKER GIRLS|25000
21107|CREAM SLICE FLANNEL PINK SPOT |59000
22589|CARDHOLDER GINGHAM STAR|99200
21641|ASSORTED TUTTI FRUTTI KEYRING BALL|33200
23161|REGENCY CAKE FORK|25000
84711B|PINK OVAL SHAPE TRINKET BOX|199000
23156|SET OF 5 MINI GROCERY MAGNETS|41600
22972|CHILDREN'S SPACEBOY MUG|33000
84997a|CHILDRENS CUTLERY POLKADOT GREEN |165800
21677|HEARTS  STICKERS|32600
23221|REINDEER HEART DECORATION SILVER|32600
84592|CROCHET ROSE PURSE WITH SUEDE BACK|59000
23273|HEART T-LIGHT HOLDER WILLIE WINKIE|65800
23517|EMBROIDERED RIBBON REEL REBECCA |57800
22749|FELTCRAFT PRINCESS CHARLOTTE DOLL|75000
44234|ASSORTED CIRCULAR MOBILE|4200
84926A|WAKE UP COCKEREL TILE COASTER|5800
22695|WICKER WREATH SMALL|65800
84952A|CLEAR LOVE BIRD T-LIGHT HOLDER|33200
23406|HOME SWEET HOME KEY HOLDER|125000
20774|GREEN FERN NOTEBOOK|33000
23219|LAUREL STAR ANTIQUE SILVER |49200
22479|DAISY GARDEN MARKER|50200
21987|PACK OF 6 SKULL PAPER CUPS|13000
23053|RECYCLED ACAPULCO MAT PINK|165000
23380|PACK OF 12 VINTAGE DOILY TISSUES|16600
21818|GLITTER HEART DECORATION|32600
23044|PAPER LANTERN 9 POINT HOLLY STAR S|83000
84872a|TEATIME FUNKY FLOWER BACKPACK FOR 2|220400
84805A|wet damaged|0
23145|ZINC T-LIGHT HOLDER STAR LARGE|41600
85032B|BLOSSOM IMAGES GIFT WRAP SET|13000
23022|SMALL BONNE JAM JAR  T-LIGHT HOLDER|41600
22135|MINI LADLE LOVE HEART PINK|16600
20936|FORKED CACTUS CANDLE|59000
23502|PLAYING CARDS VINTAGE DOILY |25000
22071|SMALL WHITE RETROSPOT MUG IN BOX |75000
22263|FELT EGG COSY LADYBIRD |17000
23073|GEORGIAN TRINKET BOX|250000
10125|MINI FUNKY DESIGN TAPES|16200
22576|SWALLOW WOODEN CHRISTMAS DECORATION|17000
20979|36 PENCILS TUBE RED RETROSPOT|25000
23213|STAR WREATH DECORATION WITH BELL|25000
22536|MAGIC DRAWING SLATE PURDEY|8400
22742|MAKE YOUR OWN PLAYTIME CARD KIT|59000
20866|BLUE ROSE FABRIC MIRROR|49200
21927|BLUE/CREAM STRIPE CUSHION COVER |25000
85071B|RED CHARLIE+LOLA PERSONAL DOORSIGN|7800
85071A|BLUE CHARLIE+LOLA PERSONAL DOORSIGN|7800
47591d|PINK FAIRY CAKE CHILDRENS APRON|99200
23375|50'S CHRISTMAS PAPER GIFT BAG|16400
85111|SILVER GLITTER FLOWER VOTIVE HOLDER|50200
22618|mouldy, unsaleable.|0
21739|COSY SLIPPER SHOES SMALL GREEN|59000
84968D|SET OF 16 VINTAGE RED CUTLERY|499200
85135A||0
21096|SET/6 FRUIT SALAD  PAPER PLATES|16600
21106|CREAM SLICE FLANNEL CHOCOLATE SPOT |115800
21518|BANK ACCOUNT  GREETING  CARD |7200
23072|MARIE ANTOINETTE TRINKET BOX SILVER|250000
23041|PAPER LANTERN 9 POINT SNOW STAR|83000
85114a|BLACK ENCHANTED FOREST PLACEMAT|65800
22774|RED DRAWER KNOB ACRYLIC EDWARDIAN|49200
20773|BLUE PAISLEY NOTEBOOK|33000
23419|HOME SWEET HOME BOTTLE |41600
85118|HEART T-LIGHT HOLDER|25000
79190B|RETRO PLASTIC POLKA TRAY|16600
21318|GLASS CHALICE BLUE SMALL |65800
84849D|HOT BATHS SOAP HOLDER|33800
79144B|PAINTED LIGHTBULB STAR+ MOON|16600
22522|CHILDS GARDEN FORK BLUE |17000
22320|BIRDS MOBILE VINTAGE DESIGN|119000
22069|BROWN  PIRATE TREASURE CHEST |65800
90175D|TIGRIS EYE CHUNKY CHARM BRACELET|183000
85135B|Found|0
22308|TEA COSY BLUE STRIPE|99200
22965|3 TRADITIONAl BISCUIT CUTTERS  SET|42000
22042|CHRISTMAS CARD SINGING ANGEL|8400
21275|ZINC TOP  2 DOOR WOODEN SHELF |665800
90013C|GREEN VINTAGE EARRINGS |83000
90123A|PINK HEART OF GLASS BRACELET|119000
23315|IVORY REFECTORY CLOCK|199000
22889|NUMBER TILE VINTAGE FONT No |42000
22078|RIBBON REEL LACE DESIGN |84200
84880|WHITE WIRE EGG HOLDER|237400
21741|COSY SLIPPER SHOES LARGE GREEN|59000
22497|SET OF 2 TINS VINTAGE BATHROOM |169400
21873|IF YOU CAN'T STAND THE HEAT MUG|25000
47422|ASSORTED MONKEY SUCTION CUP HOOK|8400
85173|SET/6 FROG PRINCE T-LIGHT CANDLES|51000
21743|STAR PORTABLE TABLE LIGHT |59000
44089A|PINK GAUZE BUTTERFLY LAMPSHADE|8400
22256|FELT FARM ANIMAL CHICKEN|25000
23487|SWEET HEART CAKE CARRIER|199000
23528|WALL ART SPACEBOY|75000
90024F|NEW BAROQUE B'FLY NECKLACE CRYSTAL|169800
20686|DOLLY MIXTURE CHILDREN'S UMBRELLA|65000
22101|MIRROR MOSAIC VOTIVE HOLDER|42000
84637|KITCHEN FLOWER POTS WALL PLAQUE|99200
23115|RED APPLES CHOPPING BOARD   |99000
84581|DOG TOY WITH PINK CROCHET SKIRT|75000
21441|BLUE BIRDHOUSE DECORATION|17000
85197|SET OF 12 MINI BUNNIES IN A BUCKET|42000
21461|BLUE EASTER EGG HUNT START POST|39000
23452|HEART MINI PORTRAIT FRAME|39000
21530|DAIRY MAID TOASTRACK|65800
20902|VINTAGE KEEPSAKE BOX PARIS DAYS|254400
23309|SET OF 60 I LOVE LONDON CAKE CASES |25000
22615|PACK OF 12 CIRCUS PARADE TISSUES |16600
21126|SET OF 6 GIRLS CELEBRATION CANDLES|49200
35912B|WHITE/PINK CHICK DECORATION|115800
15058C|ICE CREAM DESIGN GARDEN PARASOL|79000
21264|WHITE GOOSE FEATHER TREE 60CM |39000
17012E|ORIGAMI OPIUM INCENSE/CANDLE SET |50200
23324|RUSTIC STRAWBERRY JAMPOT LARGE |37000
90010A|MIDNIGHT BLUE GLASS/SILVER BRACELET|179000
22705|WRAP GREEN PEARS |8400
22102|MIRROR MOSAIC T-LIGHT HOLDER |33000
85035A|GARDENIA 3 WICK MORRIS BOXED CANDLE|25000
23597|PAPER BUNTING PAISLEY PARK|59000
20840|FRENCH FLORAL CUSHION COVER |65800
85135C|RED DRAGONFLY HELICOPTER|159000
21191|LARGE WHITE HONEYCOMB PAPER BELL  |82600
22483|RED GINGHAM TEDDY BEAR |59000
23152|IVORY SWEETHEART WIRE LETTER RACK |75000
21736|GOLD SCROLL GLASS T-LIGHT HOLDER|42000
22070|SMALL RED RETROSPOT MUG IN BOX |20000
84631|FRUIT TREE AND BIRDS WALL PLAQUE|315800
35965|FOLKART HEART NAPKIN RINGS|65800
90178A|AMBER CHUNKY GLASS+BEAD NECKLACE|233000
35957|SMALLFOLKART BAUBLE CHRISTMAS DEC|33200
84806B|WHITE CANDYSTUFT ARTIFICIAL FLOWER|29000
21428|SET3 BOOK BOX GREEN GINGHAM FLOWER |85000
35400||0
22233|JIGSAW RABBIT AND BIRDHOUSE|11800
85086A|CANDY SPOT HEART DECORATION|16600
21374|MIRRORED WALL ART SKULLS|25000
21576|LETS GO SHOPPING COTTON TOTE BAG|32600
22532|MAGIC DRAWING SLATE LEAP FROG |8400
37444A|YELLOW BREAKFAST CUP AND SAUCER|118200
20997|ROSE DU SUD CUSHION COVER |82600
72131|COLUMBIAN CANDLE RECTANGLE|39000
90205A|LARGE MINT DIAMANTE HAIRSLIDE|33800
22827|RUSTIC  SEVENTEEN DRAWER SIDEBOARD|3300000
37482P|CUBIC MUG PINK POLKADOT|7800
22936|BAKING MOULD ROSE WHITE CHOCOLATE|132600
21326|AGED GLASS SILVER T-LIGHT HOLDER|13000
90125B|AQUA BERTIE GLASS BEAD BAG CHARM|84200
84763|ZINC FINISH 15CM PLANTER POTS|25000
47481|50CM METAL STRING WITH  7 CLIPS|41600
20699|MOUSEY LONG LEGS SOFT TOY|50200
90160A|PURPLE BOUDICCA LARGE BRACELET|139000
84598|BOYS ALPHABET IRON ON PATCHES|8400
21688|SILVER PLATE CANDLE BOWL SMALL|59000
23314|VINTAGE CHRISTMAS TABLECLOTH|250000
37449|CERAMIC CAKE STAND + HANGING CAKES|199000
23119|PACK OF 6 LARGE FRUIT STRAWS |12400
23442|12 HANGING EGGS HAND PAINTED|41600
22051|BLUE SCANDINAVIAN PAISLEY WRAP|8400
84509C|SET OF 4 POLKADOT PLACEMATS |65800
23527|WALL ART ANIMALS AND NATURE |75000
37444C|PINK BREAKFAST CUP AND SAUCER |59000
23282|FOLDING BUTTERFLY MIRROR IVORY |16600
22641|SET OF 4 NAPKIN CHARMS INSTRUMENT|51000
21359|RELAX LARGE WOOD LETTERS|319000
22642|SET OF 4 NAPKIN CHARMS STARS   |99200
85130B|BEADED CRYSTAL HEART GREEN LARGE|65800
90163A|PINK ROSEBUD & PEARL NECKLACE|152800
22513|DOORSTOP FOOTBALL DESIGN|75000
22336|DOVE DECORATION PAINTED ZINC |13000
37479B|CUBIC MUG FLOCK BLUE ON BROWN|7800
22887|NUMBER TILE VINTAGE FONT 8|39000
22236|CAKE STAND 3 TIER MAGIC GARDEN|255000
23009|I LOVE LONDON BABY GIFT SET|215800
23533|WALL ART GARDEN HAVEN |119000
22198|LARGE POPCORN HOLDER |33000
22882|NUMBER TILE VINTAGE FONT 3|82600
23218|LAUREL STAR ANTIQUE GOLD|25000
22881|NUMBER TILE VINTAGE FONT 2|82600
22498|WOODEN REGATTA BUNTING|119000
85146|JARDIN ETCHED GLASS SMALL BELL JAR|39000
23695|DOILY THANK YOU CARD|16600
90072|RUBY DROP CHANDELIER EARRINGS|83000
22167| OVAL WALL MIRROR DIAMANTE |199000
90057|DIAMANTE RING ASSORTED IN BOX.|67800
90011A|MIDNIGHT BLUE CRYSTAL DROP EARRINGS|58000
21679|SKULLS  STICKERS|17000
84997A|CHILDRENS CUTLERY POLKADOT GREEN |83000
84563A|PINK & WHITE BREAKFAST TRAY|119000
23521|CAT AND BIRD WALL ART|22400
20700|GREEN CAT FLORAL CUSHION COVER |82600
23558|LANDMARK FRAME LONDON BRIDGE |250000
22259|FELT FARM ANIMAL HEN|25000
23179|CLOCK MAGNET MUM'S KITCHEN|57800
21817|GLITTER CHRISTMAS TREE|7800
79190D|RETRO PLASTIC DAISY TRAY|8400
20657|TROPICAL LUGGAGE TAG|25000
84926D|LA PALMIERA TILE COASTER|5800
21365|MIRRORED WALL ART STARS|15000
22528||0
85170D|SET/6 PINK BIRD T-LIGHT CANDLES|50200
22623|BOX OF VINTAGE JIGSAW BLOCKS |119000
22639|SET OF 4 NAPKIN CHARMS HEARTS|99200
16016|LARGE CHINESE STYLE SCISSOR|17000
23181|BULL DOG BOTTLE TOP WALL CLOCK|165000
16168M|FUNKY MONKEY GIFT BAG MEDIUM|16600
21222|SET/4 BADGES BEETLES|25000
82616B|FRAPPUCINO SCARF KNITTING KIT|49200
16218|CARTOON  PENCIL SHARPENERS|1200
23267|SET OF 4 SANTA PLACE SETTINGS|25000
22842|BISCUIT TIN VINTAGE RED|135000
71143|SILVER BOOK MARK WITH BEADS|17000
21366|MIRRORED WALL ART PHOTO FRAMES|165800
85132B|CHARLIE AND LOLA TABLE TINS|39000
23015|CORDIAL GLASS JUG|165000
23400|SHELF WITH 4 HOOKS HOME SWEET HOME|125000
85036A|GARDENIA 1 WICK MORRIS BOXED CANDLE|165800
23137|ZINC WIRE SWEETHEART LETTER TRAY|75000
22706|WRAP COWBOYS  |8400
78033|FLAG OF ST GEORGE CHAIR|85000
22221|CAKE STAND LOVEBIRD 2 TIER PINK|199000
20782|CAMOUFLAGE EAR MUFF HEADPHONES|109800
23438| RED SPOT GIFT BAG LARGE|25000
21911|GARDEN METAL SIGN |33000
21689|SILVER VANILLA  FLOWER CANDLE POT|75000
21896|POTTING SHED TWINE|84200
21291|SMALL POLKADOT CHOCOLATE GIFT BAG |17000
35967|FOLK ART METAL STAR T-LIGHT HOLDER|16600
23410|CURIO CABINET LINEN AND LACE |163000
21147|JINGLE BELLS TREE DECORATION|50200
22786|CUSHION COVER PINK UNION JACK|119000
23359|SET OF 12 T-LIGHTS VINTAGE DOILY|39000
47503H|ASS FLORAL PRINT SPIRIT LEVEL |15800
23460|SWEETHEART WALL TIDY |199000
21716|BOYS VINTAGE TIN SEASIDE BUCKET|51000
21070|VINTAGE BILLBOARD MUG |25000
21495|SKULLS AND CROSSBONES WRAP|8400
85129D|BEADED CRYSTAL HEART PINK SMALL|25000
21710|FOLDING UMBRELLA PINKWHITE POLKADOT|203400
84629|WHITE 3 FRAME BIRDS AND TREE |99000
85130D|BEADED CRYSTAL HEART PINK LARGE|33000
16202E|BLACK PHOTO ALBUM |10000
22162||0
46000U|check|0
20803|SMALL PINK GLASS SUNDAE DISH|8400
84625A|PINK NEW BAROQUECANDLESTICK CANDLE|118200
79191C|RETRO PLASTIC ELEPHANT TRAY|17000
22563|HAPPY STENCIL CRAFT|25000
22967|SET 3 SONG BIRD PAPER EGGS ASSORTED|59000
47599B|BLUE PARTY BAGS |42000
22317|FIVE CATS HANGING DECORATION|59000
84877B|GREEN ROUND COMPACT MIRROR|25000
23080|RED METAL BOX TOP SECRET|165000
23069|EDWARDIAN PHOTO FRAME|125000
90162D|ANT SILVER PURPLE BOUDICCA RING|59000
21377|SMALL CAMPHOR WOOD FIELD  MUSHROOM|65800
20669|RED HEART LUGGAGE TAG|16600
72803A|ROSE SCENT CANDLE JEWELLED DRAWER|10000
37467|PIG MUG IN TWO COLOUR DESIGNS|84200
35914|PINK CHICK EGG WARMER + EGG CUP|17000
21422|PORCELAIN ROSE SMALL|17000
21945|STRAWBERRIES  DESIGN FLANNEL |32600
21373|MIRRORED WALL ART SNOWFLAKES|15000
20681|PINK POLKADOT CHILDRENS UMBRELLA|65000
22947|WOODEN ADVENT CALENDAR RED|339000
23435|3 RAFFIA RIBBONS VINTAGE CHRISTMAS|15800
21535|RED RETROSPOT SMALL MILK JUG|51000
22450|SILK PURSE BABUSHKA BLUE|67000
22778|GLASS CLOCHE SMALL|67800
22050|PINK PAISLEY ROSE GIFT WRAP|8400
20796|SMALL BLUE PROVENCAL CERAMIC BALL|33000
23120|PACK OF 6 SMALL FRUIT STRAWS|8400
90179A|AMBER FINE BEAD NECKLACE W TASSEL|116400
35598A||0
22503|CABIN BAG VINTAGE PAISLEY|599000
84510a|SET OF 4 ENGLISH ROSE COASTERS|49200
22254|FELT TOADSTOOL LARGE|25000
85094|CANDY SPOT EGG WARMER RABBIT|16600
85032D|YULETIDE IMAGES GIFT WRAP SET|13000
23531|WALL ART BIG LOVE |139000
20998|ROSE DU SUD OVEN GLOVE|32600
22905|CALENDAR IN SEASON DESIGN|59000
21882|SKULLS TAPE|13000
22583|PACK OF 6 HANDBAG GIFT BOXES|99200
84919|BLUE CUSHION COVER WITH FLOWER|115800
20893|HANGING BAUBLE T-LIGHT HOLDER SMALL|51000
90175A|WHITE GLASS CHUNKY CHARM BRACELET|183000
23020|GLASS  SONGBIRD STORAGE JAR|250000
21285|RETROSPOT CANDLE  MEDIUM|7800
47585A|PINK FAIRY CAKE CUSHION COVER|199200
84658|WHITE STITCHED CUSHION COVER|165800
90133|TEAL/FUSCHIA COL BEAD NECKLACE|99600
23524|WALL ART HORSE & PONY |75000
85035B|CHOCOLATE 3 WICK MORRIS BOX CANDLE|65800
16216|LETTER SHAPE PENCIL SHARPENER|1200
21131|GOLD STANDING GNOME|85000
85200|BUNNY EGG BOX|25000
23513|EMBROIDERED RIBBON REEL SUSIE |41600
22117|METAL SIGN HER DINNER IS SERVED |33200
90129F|RED GLASS TASSLE BAG CHARM|33200
22517|CHILDS GARDEN RAKE PINK|42000
90167|BEADED LOVE HEART JEWELLERY SET|17000
21825||0
35915C|PEACH KNITTED HEN |33000
21014|SWISS CHALET TREE DECORATION |5800
21111|SWISS ROLL TOWEL, CHOCOLATE  SPOTS|59000
21793|CLASSIC FRENCH STYLE BASKET BROWN|79000
47559b|TEA TIME OVEN GLOVE|67200
23473|WOODLAND SMALL RED FELT HEART|16600
22033|BOTANICAL ROSE GREETING CARD|8400
46776D|WOVEN SUNSET CUSHION COVER |82600
90177D|DROP DIAMANTE EARRINGS PURPLE|59000
21371|MIRRORED WALL ART POPPIES|99200
90000B|MIDNIGHT BLUE COPPER FLOWER NECKLAC|124600
20821|GOLDIE LOOKING MIRROR|99000
90003B|ROSE COLOUR PAIR HEART HAIR SLIDES|76200
22409|MONEY BOX BISCUITS DESIGN|25000
22454|MEASURING TAPE BABUSHKA RED|59000
15030|FAN BLACK FRAME |5800
51020A|SUMMER FUN DESIGN SHOWER CAP|25000
84674|FLYING PIG WATERING CAN|59000
23388|WOODLAND MINI BACKPACK|83000
37501|TEA TIME TEA SET IN GIFT BOX|115800
85186C|BUNNY EGG GARLAND|16600
37487B|Damaged|0
22132|RED LOVE HEART SHAPE CUP|17000
21143|ANTIQUE GLASS HEART DECORATION |39000
72709|IVORY SCULPTED RND CANDLE |17000
21327|SKULLS WRITING SET |49200
84507C|BLUE CIRCLES DESIGN MONKEY DOLL|51000
23454|THREE MINI HANGING FRAMES|83000
22757|LARGE RED BABUSHKA NOTEBOOK |25000
DCGS0076|SUNJAR LED NIGHT NIGHT LIGHT|322600
21594||0
22047|EMPIRE GIFT WRAP|8400
23123|COCKTAIL SWORDS 50 PIECES|16600
21613|S/12 VANILLA  BOTANICAL T-LIGHTS|59000
21788|KIDS RAIN MAC BLUE|17000
82613D|METAL SIGN CUPCAKE SINGLE HOOK|16600
21197|MULTICOLOUR  CONFETTI IN TUBE|65800
23462|ROCOCO WALL MIRROR WHITE|399000
47518F|ICON PLACEMAT POP ART ELVIS|2400
22912|YELLOW COAT RACK PARIS FASHION|99000
20935|ROUND CACTUS CANDLE|59000
37333||0
23480|MINI LIGHTS WOODLAND MUSHROOMS|149200
21820|GLITTER HEART GARLAND WITH BELLS |67800
22106|MIRROR MOSAIC HURRICANE LAMP |135000
21333|CLASSIC WHITE FRAME|59000
20869|GOLD FABRIC MIRROR|7800
21986|PACK OF 12 PINK POLKADOT TISSUES|5800
84968F|SET OF 16 VINTAGE SKY BLUE CUTLERY|255000
22510|GINGHAM BABUSHKA DOORSTOP|75000
47591B|SCOTTIES CHILDRENS APRON|33200
