21175|GIN + TONIC DIET METAL SIGN|51000
20867|PINK ROSE FABRIC MIRROR|16600
20801|LARGE PINK GLASS SUNDAE DISH|15800
47590B|PINK HAPPY BIRTHDAY BUNTING|109000
22743|MAKE YOUR OWN FLOWERPOWER CARD KIT|59000
23293|SET OF 12 FAIRY CAKE BAKING CASES|16600
21746|SMALL RED RETROSPOT WINDMILL|25000
22358|KINGS CHOICE TEA CADDY |49200
22554|PLASTERS IN TIN WOODLAND ANIMALS|33000
22471|TV DINNER TRAY AIR HOSTESS |82600
23035|DRAWER KNOB CERAMIC IVORY|29000
21258|VICTORIAN SEWING BOX LARGE|255000
23197|SKETCHBOOK MAGNETIC SHOPPING LIST|29000
23395|BELLE JARDINIERE CUSHION COVER|75000
22674|FRENCH TOILET SIGN BLUE METAL|25000
21694|SMALL REGAL  SILVER CANDLEPOT |115800
21527|RED RETROSPOT TRADITIONAL TEAPOT |159000
22943|CHRISTMAS LIGHTS 10 VINTAGE BAUBLES|99000
23203|JUMBO BAG DOILEY PATTERNS|41600
22288|HANGING METAL RABBIT DECORATION|49200
22090|PAPER BUNTING RETROSPOT|59000
22773|GREEN DRAWER KNOB ACRYLIC EDWARDIAN|59000
22133|PINK LOVE HEART SHAPE CUP|17000
22278|OVERNIGHT BAG VINTAGE ROSE PAISLEY|215800
82583|HOT BATHS METAL SIGN|42000
21280|VINTAGE KITCHEN PRINT VEGETABLES|51000
21519|GIN & TONIC DIET GREETING CARD |16600
22779|WOODEN OWLS LIGHT GARLAND |85000
23178|JAM CLOCK MAGNET|57800
21786|POLKADOT RAIN HAT |8400
84029E|RED WOOLLY HOTTIE WHITE HEART.|85000
23376|PACK OF 12 VINTAGE CHRISTMAS TISSUE|7800
23270|SET OF 2 CERAMIC PAINTED HEARTS |29000
85014B|RED RETROSPOT UMBRELLA|119000
21915|RED  HARMONICA IN BOX |25000
85036B|CHOCOLATE 1 WICK MORRIS BOX CANDLE|85000
22961|JAM MAKING SET PRINTED|65800
22083|PAPER CHAIN KIT RETROSPOT|59000
20717|STRAWBERRY SHOPPER BAG|67200
23290|SPACEBOY CHILDRENS BOWL|25000
21520|BOOZE & WOMEN GREETING CARD |16600
37342|POLKADOT COFFEE CUP & SAUCER PINK|15800
37446|MINI CAKE STAND WITH HANGING CAKES|29000
22138|BAKING SET 9 PIECE RETROSPOT |99000
84078A|SET/4 WHITE RETRO STORAGE CUBES |1165800
70006|LOVE HEART POCKET WARMER|65800
21742|LARGE ROUND WICKER PLATTER |119000
82600|N0 SINGING METAL SIGN|82600
22452|MEASURING TAPE BABUSHKA PINK|32600
22653|BUTTON BOX |32600
21983|PACK OF 12 BLUE PAISLEY TISSUES |7800
21676|FLOWERS  STICKERS|17000
22662|LUNCH BAG DOLLY GIRL DESIGN|33000
23191|BUNDLE OF 3 RETRO NOTE BOOKS|33000
22227|HANGING HEART MIRROR DECORATION |25000
22185|SLATE TILE NATURAL HANGING|15800
21704|BAG 250g SWIRLY MARBLES|17000
22907|PACK OF 20 NAPKINS PANTRY DESIGN|17000
20713|JUMBO BAG OWLS|82600
21231|SWEETHEART CERAMIC TRINKET BOX|25000
22523|CHILDS GARDEN FORK PINK|17000
21578|WOODLAND DESIGN  COTTON TOTE BAG|45000
23378|PACK OF 12 50'S CHRISTMAS TISSUES|7800
84997d|CHILDRENS CUTLERY POLKADOT PINK|165800
22818|CARD CHRISTMAS VILLAGE|8400
37495|FAIRY CAKE BIRTHDAY CANDLE SET|75000
84997C|CHILDRENS CUTLERY POLKADOT BLUE|83000
21212|PACK OF 72 RETROSPOT CAKE CASES|11000
23369|SET 36 COLOUR PENCILS LOVE LONDON|25000
21833|CAMOUFLAGE LED TORCH|33800
22377|BOTTLE BAG RETROSPOT |32600
22620|4 TRADITIONAL SPINNING TOPS|29000
21242|RED RETROSPOT PLATE |33800
23165|LARGE CERAMIC TOP STORAGE JAR|65800
84006|MAGIC TREE -PAPER FLOWERS|33200
21042|RED RETROSPOT APRON |119000
72802B|OCEAN SCENT CANDLE IN JEWELLED BOX|85000
22819|BIRTHDAY CARD, RETRO SPOT|8400
22804|CANDLEHOLDER PINK HANGING HEART|115800
22867|HAND WARMER BIRD DESIGN|42000
23200|JUMBO BAG PEARS|41600
16169E|WRAP 50'S  CHRISTMAS|8400
22382|LUNCH BAG SPACEBOY DESIGN |33000
23209|LUNCH BAG DOILEY PATTERN |33000
23198|PANTRY MAGNETIC  SHOPPING LIST|29000
23184|BULL DOG BOTTLE OPENER|99000
15036|ASSORTED COLOURS SILK FAN|32600
85203|HANGING WOOD AND FELT BUTTERFLY |8400
20982|12 PENCILS TALL TUBE SKULLS|17000
23281|FOLDING BUTTERFLY MIRROR RED  |14400
23336|EGG FRYING PAN PINK |41600
22432|WATERING CAN PINK BUNNY|39000
21452|TOADSTOOL MONEY BOX|59000
22170|PICTURE FRAME WOOD TRIPLE PORTRAIT|135000
22572|ROCKING HORSE GREEN CHRISTMAS |17000
22544|MINI JIGSAW SPACEBOY|7200
22553|PLASTERS IN TIN SKULLS|33000
22060|LARGE CAKE STAND HANGING HEARTS|79000
23335|EGG FRYING PAN IVORY |41600
22295|HEART FILIGREE DOVE LARGE|33000
79051A|SMOKEY GREY COLOUR GLASS|5800
23092|LARGE ANTIQUE WHITE PHOTO FRAME|315800
21700|BIG DOUGHNUT FRIDGE MAGNETS|165800
22155|STAR DECORATION RUSTIC|8400
21977|PACK OF 60 PINK PAISLEY CAKE CASES|11000
21328|BALLOONS  WRITING SET |33000
21189|WHITE HONEYCOMB PAPER GARLAND |65800
22231|JIGSAW TREE WITH BIRDHOUSE|29000
23166|MEDIUM CERAMIC TOP STORAGE JAR|25000
84212|ASSORTED FLOWER COLOUR "LEIS"|13000
22151|PLACE SETTING WHITE HEART|8400
22349|DOG BOWL CHASING BALL DESIGN|75000
22285|HANGING HEN ON NEST DECORATION|33000
18007|ESSENTIAL BALM 3.5g TIN IN ENVELOPE|8400
21481|FAWN BLUE HOT WATER BOTTLE|75000
D|Discount|260000
21294|ETCHED GLASS COASTER|7800
82613B|METAL SIGN,CUPCAKE SINGLE HOOK|25000
23312|VINTAGE CHRISTMAS GIFT SACK|83000
22614|PACK OF 12 SPACEBOY TISSUES|17000
22767|TRIPLE PHOTO FRAME CORNICE |199000
22551|PLASTERS IN TIN SPACEBOY|33000
22917|HERB MARKER ROSEMARY|13000
23446|BLUE BUNNY EASTER EGG BASKET|33000
21581|SKULLS  DESIGN  COTTON TOTE BAG|32600
21634|ASSORTED MINI MADRAS NOTEBOOK|50200
22474|SPACEBOY TV DINNER TRAY|99000
22088|PAPER BUNTING COLOURED LACE|59000
23368|SET 12 COLOUR PENCILS DOLLY GIRL |13000
22970|LONDON BUS COFFEE MUG|51000
85131C|BEADED CRYSTAL HEART BLUE ON STICK|16600
22061|LARGE CAKE STAND  HANGING STRAWBERY|415800
22438|BALLOON ART MAKE YOUR OWN FLOWERS|33200
21564|PINK  HEART SHAPE LOVE BUCKET |59000
21381|MINI WOODEN HAPPY BIRTHDAY GARLAND|33800
21003|ROSE DU SUD CUSHION COVER|115800
22189|CREAM HEART CARD HOLDER|79000
21851|LILAC DIAMANTE PEN IN GIFT BOX|84200
16161P|WRAP ENGLISH ROSE |8400
84050|PINK HEART SHAPE EGG FRYING PAN|82600
22136|LOVE HEART SOCK HANGER|65800
21244|BLUE POLKADOT PLATE |65800
22696|WICKER WREATH LARGE|39000
23344|JUMBO BAG 50'S CHRISTMAS |41600
20712|JUMBO BAG WOODLAND ANIMALS|82600
84535B|FAIRY CAKES NOTEBOOK A6 SIZE|13000
23426|METAL SIGN DROP YOUR PANTS|57800
72800E|4 IVORY DINNER CANDLES SILVER FLOCK|51000
22348|TEA BAG PLATE RED RETROSPOT|17000
23541|WALL ART CLASSIC PUDDINGS |165000
22169|FAMILY ALBUM WHITE PICTURE FRAME|170000
22578|WOODEN STAR CHRISTMAS SCANDINAVIAN|5800
21167|WHITE SAGE INCENSE|4200
72800C|4 PINK DINNER CANDLE SILVER FLOCK|99200
21830|damaged|0
22420|LIPSTICK PEN BABY PINK|16600
47559B|TEA TIME OVEN GLOVE|25000
22602|RETROSPOT WOODEN HEART DECORATION|32600
22200|FRYING PAN PINK POLKADOT|165800
48194|DOORMAT HEARTS|315800
22164|STRING OF STARS CARD HOLDER|59000
22196|SMALL HEART MEASURING SPOONS|33200
17012B|ORIGAMI JASMINE INCENSE/CANDLE SET|50200
21991|BOHEMIAN COLLAGE STATIONERY SET|49200
22380|TOY TIDY SPACEBOY  |82600
22756|LARGE YELLOW BABUSHKA NOTEBOOK |25000
84755|COLOUR GLASS T-LIGHT HOLDER HANGING|13000
22055|MINI CAKE STAND  HANGING STRAWBERY|65800
22489|PACK OF 12 TRADITIONAL CRAYONS|16600
22378|WALL TIDY RETROSPOT |42000
22333|RETROSPOT PARTY BAG + STICKER SET|65800
22073|RED RETROSPOT STORAGE JAR|67800
35598D|PINK/WHITE CHRISTMAS TREE 60CM|49200
72741|GRAND CHOCOLATECANDLE|56400
23144|ZINC T-LIGHT HOLDER STARS SMALL|32600
22737|RIBBON REEL CHRISTMAS PRESENT |33000
90161A|ANT COPPER RED BOUDICCA BRACELET|99000
22274|FELTCRAFT DOLL EMILY|59000
21164|HOME SWEET HOME METAL SIGN |59000
21683|MEDIUM MEDINA STAMPED METAL BOWL |59000
23005|TRAVEL CARD WALLET I LOVE LONDON|16600
22494|EMERGENCY FIRST AID TIN |49200
23108|SET OF 10 LED DOLLY LIGHTS|107800
23253|16 PIECE CUTLERY SET PANTRY DESIGN|665800
22596|CHRISTMAS STAR WISH LIST CHALKBOARD|25000
22942|CHRISTMAS LIGHTS 10 SANTAS |170000
23212|HEART WREATH DECORATION WITH BELL|25000
22758|LARGE PURPLE BABUSHKA NOTEBOOK  |25000
21670|BLUE SPOT CERAMIC DRAWER KNOB|25000
23211|RED ROCKING HORSE HAND PAINTED|25000
22595|GINGHAM HEART DECORATION|17000
22711|WRAP CIRCUS PARADE|8400
22872|NUMBER TILE COTTAGE GARDEN 4|39000
35953|FOLKART STAR CHRISTMAS DECORATIONS|7800
21385|IVORY HANGING DECORATION  HEART|17000
22418|10 COLOUR SPACEBOY PEN|17000
22385|JUMBO BAG SPACEBOY DESIGN|41600
16219|HOUSE SHAPE PENCIL SHARPENER|16600
16014|SMALL CHINESE STYLE SCISSOR|6400
22631|CIRCUS PARADE LUNCH BOX |39000
21080|SET/20 RED RETROSPOT PAPER NAPKINS |33200
23264|SET OF 3 WOODEN SLEIGH DECORATIONS|25000
22792|FLUTED ANTIQUE CANDLE HOLDER|32600
22955|36 FOIL STAR CAKE CASES |42000
22179|SET 10 NIGHT OWL LIGHTS|265800
84913B|MINT GREEN ROSE TOWEL|93000
22692|DOORMAT WELCOME TO OUR HOME|159000
22539|MINI JIGSAW DOLLY GIRL|16600
22748|POPPY'S PLAYHOUSE KITCHEN|42000
22130|PARTY CONE CHRISTMAS DECORATION |17000
23352|ROLL WRAP 50'S RED CHRISTMAS |25000
22974|CHILDRENS DOLLY GIRL MUG|33000
22746|POPPY'S PLAYHOUSE LIVINGROOM |42000
23079|TOADSTOOL BEDSIDE LIGHT |179000
22918|HERB MARKER PARSLEY|13000
21666|RIDGED GLASS T-LIGHT HOLDER|13000
22632|HAND WARMER RED RETROSPOT|42000
84596B|SMALL DOLLY MIX DESIGN ORANGE BOWL|16600
22739|RIBBON REEL CHRISTMAS SOCK BAUBLE|65800
23193|BUFFALO BILL TREASURE BOOK BOX|45000
21632|VINTAGE PINK DECORATIVE PARASOL|169400
22587|FELTCRAFT HAIRBAND RED AND BLUE|17000
DOT|DOTCOM POSTAGE|2235800
23229|VINTAGE DONKEY TAIL GAME |75000
22768|FAMILY PHOTO FRAME CORNICE|199000
22643|SET OF 4 NAPKIN CHARMS LEAVES   |32600
22384|LUNCH BAG PINK POLKADOT|33000
22082|RIBBON REEL STRIPES DESIGN |33000
72351A|SET/6 TURQUOISE BUTTERFLY T-LIGHTS|42000
22208|WOOD STAMP SET THANK YOU|33000
20668|DISCO BALL CHRISTMAS DECORATION|2400
84796a|PINK HAWAIIAN PICNIC HAMPER FOR 2|165800
20654|FIRST CLASS LUGGAGE TAG |25000
23132|SMALL IVORY HEART WALL ORGANISER|115000
90201C|RED ENAMEL FLOWER RING|59000
23147|SINGLE ANTIQUE ROSE HOOK IVORY|29000
21508|VINTAGE KID DOLLY CARD |8400
22321|BIRD DECORATION RED RETROSPOT|32600
23318|BOX OF 6 MINI VINTAGE CRACKERS|41600
22501|PICNIC BASKET WICKER LARGE|424600
21563|RED HEART SHAPE LOVE BUCKET |59000
23332|IVORY WICKER HEART LARGE|33000
46776A|WOVEN BUBBLE GUM CUSHION COVER|82600
23614|SET 10 CARDS 12 DAYS WRAP  17058|66600
23425|STORAGE TIN HOME SWEET HOME|49800
20771|CHRYSANTHEMUM  JOURNAL|49200
21808|CHRISTMAS GARLAND STARS,TREES|65800
22848|BREAD BIN DINER STYLE PINK|665800
21354|TOAST ITS - BEST MUM|25000
21673|WHITE SPOT BLUE CERAMIC DRAWER KNOB|49200
22180|RETROSPOT LAMP|199000
22053|EMPIRE DESIGN ROSETTE|25000
23100|SILVER BELLS TABLE DECORATION|25000
21990|MODERN FLORAL STATIONERY SET|25000
22664|TOY TIDY DOLLY GIRL DESIGN|42000
21894|POTTING SHED SEED ENVELOPES|50200
20777|CHRYSANTHEMUM NOTEBOOK|33000
22472|TV DINNER TRAY DOLLY GIRL|215800
23049|RECYCLED ACAPULCO MAT RED|165000
48188|DOORMAT WELCOME PUPPIES|165000
20622|VIPPASSPORT COVER |33200
22573|STAR WOODEN CHRISTMAS DECORATION|17000
22502|PICNIC BASKET WICKER SMALL|165800
21976|PACK OF 60 MUSHROOM CAKE CASES|11000
22343|PARTY PIZZA DISH RED RETROSPOT|17000
23068|ALUMINIUM STAMPED HEART|49800
22671|FRENCH LAUNDRY SIGN BLUE METAL|65800
21928|JUMBO BAG SCANDINAVIAN BLUE PAISLEY|41600
23268|SET OF 2 CERAMIC CHRISTMAS REINDEER|29000
35648|VINTAGE BEAD PINK PURSE |32600
22946|WOODEN ADVENT CALENDAR CREAM|339000
22835|HOT WATER BOTTLE I AM SO POORLY|85000
47480|HANGING PHOTO CLIP ROPE LADDER|33000
22534|MAGIC DRAWING SLATE SPACEBOY |8400
23013|GLASS APOTHECARY BOTTLE TONIC|79000
37327|ASSTD MULTICOLOUR CIRCLES MUG|7800
82483|WOOD 2 DRAWER CABINET WHITE FINISH|139000
21531|RED RETROSPOT SUGAR JAM BOWL|51000
23057|BEADED CHANDELIER T-LIGHT HOLDER|30000
21801|CHRISTMAS TREE DECORATION WITH BELL|8400
22584|PACK OF 6 PANNETONE GIFT BOXES|51000
21577|SAVE THE PLANET COTTON TOTE BAG|45000
23058|CHRISTMAS HANGING SNOWFLAKE|15800
22962|JAM JAR WITH PINK LID|32600
22076|6 RIBBONS EMPIRE  |25000
37471|MULTICOLOUR POLKADOT PLATE|17000
22030|SWALLOWS GREETING CARD|8400
85159A|BLACK TEA,COFFEE,SUGAR JARS|39000
23206|LUNCH BAG APPLE DESIGN|33000
21058|PARTY INVITES WOODLAND|17000
22555|PLASTERS IN TIN STRONGMAN|33000
20659|ECONOMY LUGGAGE TAG|16600
21877|HOME SWEET HOME MUG|25000
23349|ROLL WRAP VINTAGE CHRISTMAS|25000
22789|T-LIGHT HOLDER SWEETHEART HANGING|39000
22862||0
22435|SET OF 9 HEART SHAPED BALLOONS|25000
21619|4 VANILLA BOTANICAL CANDLES|25000
22095|LADS ONLY TISSUE BOX|49200
84884a|ANT WHITE WIRE HEART SPIRAL|169400
21539|RED RETROSPOT BUTTER DISH|99000
22174|PHOTO CUBE|82600
21289|LARGE STRIPES CHOCOLATE GIFT BAG|25000
22421|LIPSTICK PEN FUSCHIA|8400
23295|SET OF 12 MINI LOAF BAKING CASES|16600
23162|REGENCY TEA STRAINER|75000
23307|SET OF 60 PANTRY DESIGN CAKE CASES |11000
23300|GARDENERS KNEELING PAD CUP OF TEA |33000
85071D|CHARLIE+LOLA MY ROOM DOOR SIGN|16600
21579|LOLITA  DESIGN  COTTON TOTE BAG|45000
22821|GIFT BAG PSYCHEDELIC APPLES|13000
48111|DOORMAT 3 SMILEY CATS|159000
46775D||0
22594|CHRISTMAS GINGHAM TREE|32600
22065|CHRISTMAS PUDDING TRINKET POT |7800
85179C|PINK BITTY LIGHT CHAIN|49200
23239|SET OF 4 KNICK KNACK TINS POPPIES|165800
22066|LOVE HEART TRINKET POT|7800
75049L|LARGE CIRCULAR MIRROR MOBILE|25000
21745|GAOLERS KEYS DECORATIVE GARDEN |75000
23504|PLAYING CARDS JUBILEE UNION JACK|25000
22619|SET OF 6 SOLDIER SKITTLES|75000
23051|RECYCLED ACAPULCO MAT BLUE|165000
21890|S/6 WOODEN SKITTLES IN COTTON BAG|65000
22592|CARDHOLDER HOLLY WREATH METAL|75000
84519B|CARROT CHARLIE+LOLA COASTER SET|25000
22725|ALARM CLOCK BAKELIKE CHOCOLATE|149200
22744|MAKE YOUR OWN MONSOON CARD KIT|115800
90200C|BLUE SWEETHEART BRACELET|85000
22690|DOORMAT HOME SWEET HOME BLUE |159000
23382|BOX OF 6 CHRISTMAS CAKE DECORATIONS|75000
20961|STRAWBERRY BATH SPONGE |49200
10080|GROOVY CACTUS INFLATABLE|7800
84974|S/2 ZINC HEART DESIGN PLANTERS|199000
90019A|SILVER M.O.P ORBIT BRACELET|108000
22751|FELTCRAFT PRINCESS OLIVIA DOLL|149200
22606|WOODEN SKITTLES GARDEN SET|255000
21868||0
22968|ROSE COTTAGE KEEPSAKE BOX |170000
20674|GREEN POLKADOT BOWL|25000
22318|FIVE HEART HANGING DECORATION|115800
22405|MONEY BOX POCKET MONEY DESIGN|7800
17012F|ORIGAMI SANDLEWOOD INCENSE/CAND SET|17000
22212|FOUR HOOK  WHITE LOVEBIRDS|82600
22427|ENAMEL FLOWER JUG CREAM|119000
23345| DOLLY GIRL BEAKER|49200
22468|BABUSHKA LIGHTS STRING OF 10|135000
20750|RED RETROSPOT MINI CASES|159000
23301|GARDENERS KNEELING PAD KEEP CALM |29000
22916|HERB MARKER THYME|13000
21843|RED RETROSPOT CAKE STAND|219000
84802B|PURPLE ANEMONE ARTIFICIAL FLOWER|33800
21787|RAIN PONCHO RETROSPOT|17000
22754|SMALL RED BABUSHKA NOTEBOOK |4200
22924|FRIDGE MAGNETS LA VIE EN ROSE|17000
22895|SET OF 2 TEA TOWELS APPLE AND PEARS|59000
20735|BLACK MINI TAPE MEASURE |17000
23077|DOUGHNUT LIP GLOSS |25000
85232D|SET/3 DECOUPAGE STACKING TINS|99000
22826|LOVE SEAT ANTIQUE WHITE METAL|1700000
85202|HANGING WOOD AND FELT HEART|8400
22142|CHRISTMAS CRAFT WHITE FAIRY |29000
23285|PINK VINTAGE SPOT BEAKER|17000
22920|HERB MARKER BASIL|13000
22493|PAINT YOUR OWN CANVAS SET|33000
22294|HEART FILIGREE DOVE  SMALL|25000
22931|BAKING MOULD HEART WHITE CHOCOLATE|51000
22832|BROCANTE SHELF WITH HOOKS|215000
23139|SINGLE WIRE HOOK PINK HEART|29000
21262|WHITE GOOSE FEATHER CHRISTMAS TREE |59000
22609|PENS ASSORTED SPACEBALL|3800
21819|GLITTER CHRISTMAS STAR |7800
90119|METALIC LEAVES BAG CHARMS|49200
22613|PACK OF 20 SPACEBOY NAPKINS|17000
72051S|BAG OF SILVER STONES|8400
22182|CAKE STAND VICTORIAN FILIGREE SMALL|82600
21506|FANCY FONT BIRTHDAY CARD, |16600
22296|HEART IVORY TRELLIS LARGE|33000
20986|BLUE CALCULATOR RULER|49200
23389|SPACEBOY MINI BACKPACK|83000
16011|ANIMAL STICKERS|4200
21355|TOAST ITS - I LOVE YOU |25000
23007| SPACEBOY BABY GIFT SET|215800
21630|FLOOR CUSHION ELEPHANT CARNIVAL|365800
23350|ROLL WRAP VINTAGE SPOT |25000
21352|EUCALYPTUS & PINECONE  WREATH|115800
22938|CUPCAKE LACE PAPER SET 6|39000
21239|PINK  POLKADOT CUP|33200
21647|ASSORTED TUTTI FRUTTI LARGE PURSE|42000
85087|CANDY SPOT CUSHION COVER|65800
85131A|BEADED PEARL HEART WHITE ON STICK|25000
22446|PIN CUSHION BABUSHKA PINK|67000
22173|METAL 4 HOOK HANGER FRENCH CHATEAU|115800
85014A|BLACK/BLUE POLKADOT UMBRELLA|119000
22732|3D VINTAGE CHRISTMAS STICKERS |50200
21430|SET/3 RED GINGHAM ROSE STORAGE BOX|75000
22352|LUNCH BOX WITH CUTLERY RETROSPOT |51000
23126|FELTCRAFT GIRL AMELIE KIT|99000
22533|check|0
23489|VINTAGE BELLS GARLAND|57800
20802|SMALL GLASS SUNDAE DISH CLEAR|33000
21624|VINTAGE UNION JACK DOORSTOP|119000
21713|CITRONELLA CANDLE FLOWERPOT|42000
20716|PARTY FOOD SHOPPER BAG|25000
84251C|GREETING CARD, TWO SISTERS.|8400
23014|GLASS APOTHECARY BOTTLE ELIXIR|79000
22627|MINT KITCHEN SCALES|170000
15034|PAPER POCKET TRAVELING FAN |2800
21114|LAVENDER SCENTED FABRIC HEART|215800
84247L|FAWN AND MUSHROOM GREETING CARD|17000
22734|SET OF 6 RIBBONS VINTAGE CHRISTMAS|57800
23243|SET OF TEA COFFEE SUGAR TINS PANTRY|215800
85049G|CHOCOLATE BOX RIBBONS |49200
21791|VINTAGE HEADS AND TAILS CARD GAME |49200
72807B|SET/3 OCEAN SCENT CANDLE JEWEL BOX|85000
84563B|BLUE & WHITE BREAKFAST TRAY|119000
23082|SET 6 PAPER TABLE LANTERN HEARTS |75000
22228|BUNNY WOODEN PAINTED WITH BIRD |17000
23254|CHILDRENS CUTLERY DOLLY GIRL |83000
23172|REGENCY TEA PLATE PINK|33000
23322|LARGE WHITE HEART OF WICKER|59000
84913A|SOFT PINK ROSE TOWEL |65800
84030E|ENGLISH ROSE HOT WATER BOTTLE|85000
22443|GROW YOUR OWN HERBS SET OF 3|159000
22113|GREY HEART HOT WATER BOTTLE|169400
22717|CARD DOG AND BALL |8400
84971S|SMALL HEART FLOWERS HOOK |32600
22476|EMPIRE UNION JACK TV DINNER TRAY|99000
22669|RED BABY BUNTING |59000
23127|FELTCRAFT GIRL NICOLE KIT|99000
22550|HOLIDAY FUN LUDO|152400
22766|PHOTO FRAME CORNICE|59000
22579|WOODEN TREE CHRISTMAS SCANDINAVIAN|5800
23571|TRADITIONAL NAUGHTS & CROSSES|33000
22110|BIRD HOUSE HOT WATER BOTTLE|51000
84992|72 SWEETHEART FAIRY CAKE CASES|11000
23170|REGENCY TEA PLATE ROSES |65800
90214A|LETTER "A" BLING KEY RING|17000
21394|RED POLKADOT BEAKER |7800
20655|QUEEN OF SKIES LUGGAGE TAG|25000
84536A|ENGLISH ROSE NOTEBOOK A7 SIZE|16600
21810|CHRISTMAS HANGING STAR WITH BELL|7800
21774|DECORATIVE CATS BATHROOM BOTTLE|25000
21171|BATHROOM METAL SIGN |29000
21528|DAIRY MAID TRADITIONAL TEAPOT |115800
47566b|TEA TIME PARTY BUNTING|165800
79321|CHILLI LIGHTS|249200
23109|PACK OF SIX LED TEA LIGHTS|57800
21735|TWO DOOR CURIO CABINET|255000
90200A|PURPLE SWEETHEART BRACELET|83000
22718|CARD CAT AND TREE |8400
85071C|CHARLIE+LOLA"EXTREMELY BUSY" SIGN|7800
21698|MOCK LOBSTER FRIDGE MAGNET|17000
21749|LARGE RED RETROSPOT WINDMILL|42000
22276|WASH BAG VINTAGE ROSE PAISLEY|51000
23456|MEDIUM PARLOUR PICTURE FRAME |83000
23275|SET OF 3 HANGING OWLS OLLIE BEAK|25000
85169D|PINK LOVE BIRD CANDLE|25000
84509A|SET OF 4 ENGLISH ROSE PLACEMATS|75000
22268|EASTER DECORATION SITTING BUNNY|17000
21715|GIRLS VINTAGE TIN SEASIDE BUCKET|99200
22574|HEART WOODEN CHRISTMAS DECORATION|17000
23129|HEART SHAPED HOLLY WREATH|83000
22416|SET OF 36 DOILIES SPACEBOY DESIGN |29000
21523|DOORMAT FANCY FONT HOME SWEET HOME|159000
35964|FOLKART CLIP ON STARS|32600
22068|BLACK PIRATE TREASURE CHEST|33000
23557|LANDMARK FRAME BAKER STREET |250000
21884|CAKES AND BOWS GIFT  TAPE|8600
82580|BATHROOM METAL SIGN|25000
21811|HANGING HEART WITH BELL|49200
21066|VINTAGE RED MUG|49200
20670|VIP HOLIDAY PURSE|59000
23116|VEGETABLE GARDEN CHOPPING BOARD|99000
11001|ASSTD DESIGN RACING CAR PEN|16600
72232|FENG SHUI PILLAR CANDLE|3800
21901|KEY FOB , BACK DOOR |13000
21201|TROPICAL  HONEYCOMB PAPER GARLAND |42000
22426|ENAMEL WASH BOWL CREAM|75000
22863|SOAP DISH BROCANTE|59000
23535|WALL ART BICYCLE SAFETY|119000
23313|VINTAGE CHRISTMAS BUNTING|99000
20856|DENIM PATCH PURSE PINK BUTTERFLY|33000
21985|PACK OF 12 HEARTS DESIGN TISSUES |5800
23414|ZINC BOX SIGN HOME|199000
23444|Next Day Carriage|3e+05
22898|CHILDRENS APRON APPLES DESIGN|39000
22444|GROW YOUR OWN PLANT IN A CAN |25000
21174|POTTERING IN THE SHED METAL SIGN|41600
35966||0
79144C|PAINTED LIGHTBULB RAINBOW DESIGN|16800
47594A|CAROUSEL DESIGN WASHBAG|39000
21340|CLASSIC METAL BIRDCAGE PLANT HOLDER|199000
22928|YELLOW GIANT GARDEN THERMOMETER|119000
22495|SET OF 2 ROUND TINS CAMEMBERT |59000
21870|I CAN ONLY PLEASE ONE PERSON MUG|67200
22684|FRENCH BLUE METAL DOOR SIGN 9|49200
23466|TUSCAN VILLA DOVECOTE BIRD FEEDER|165000
22689|DOORMAT MERRY CHRISTMAS RED |165000
21108|FAIRY CAKE FLANNEL ASSORTED COLOUR|51000
22851|SET 20 NAPKINS FAIRY CAKES DESIGN |17000
22837|HOT WATER BOTTLE BABUSHKA |182600
84949|SILVER HANGING T-LIGHT HOLDER|29000
23168|CLASSIC CAFE SUGAR DISPENSER|25000
22923|FRIDGE MAGNETS LES ENFANTS ASSORTED|17000
22114|HOT WATER BOTTLE TEA AND SYMPATHY|79000
22413|METAL SIGN TAKE IT OR LEAVE IT |59000
22593|CHRISTMAS GINGHAM STAR|17000
21686|MEDINA STAMPED METAL STOOL|799000
85034A|3 GARDENIA MORRIS BOXED CANDLES|169400
84976|RECTANGULAR SHAPED MIRROR|15800
21154|RED RETROSPOT OVEN GLOVE |25000
21556|CERAMIC STRAWBERRY MONEY BOX|51000
20975|12 PENCILS SMALL TUBE RED RETROSPOT|13000
22350|ILLUSTRATED CAT BOWL |51000
23374|RED SPOT PAPER GIFT BAG|16400
85053|FRENCH ENAMEL CANDLEHOLDER|42000
21642|ASSORTED TUTTI FRUTTI PEN|5800
84510C|SET OF 4 POLKADOT COASTERS|49200
22816|CARD MOTORBIKE SANTA|8400
82615|PINK MARSHMALLOW SCARF KNITTING KIT|51000
23138|SINGLE WIRE HOOK IVORY HEART|29000
21907|I'M ON HOLIDAY METAL SIGN|82600
62097B|BLUE STRIPES SHOULDER BAG|16600
23287|RED VINTAGE SPOT BEAKER|17000
23157|SET OF 6 NATIVITY MAGNETS |41600
22085|PAPER CHAIN KIT SKULLS |59000
84613C|BLUE NEW BAROQUE FLOCK CANDLESTICK|93000
22466|FAIRY TALE COTTAGE NIGHTLIGHT|39000
84520B|PACK 20 ENGLISH ROSE PAPER NAPKINS|32600
21844|RED RETROSPOT MUG|59000
82486|3 DRAWER ANTIQUE WHITE WOOD CABINET|179000
21204|DAISIES  HONEYCOMB GARLAND |33000
22603|CHRISTMAS RETROSPOT TREE WOOD|17000
21988|PACK OF 6 SKULL PAPER PLATES|12800
23297|SET 40 HEART SHAPE PETIT FOUR CASES|33000
23054|RECYCLED ACAPULCO MAT LAVENDER|165000
22728|ALARM CLOCK BAKELIKE PINK|152400
84817|DANISH ROSE DECORATIVE PLATE|42000
22976|CIRCUS PARADE CHILDRENS EGG CUP |25000
21709|FOLDING UMBRELLA CHOCOLATE POLKADOT|199200
21692|SILVER LATTICE VANILLA CANDLE POT|75000
85204|HANGING WOOD AND FELT FLOWER|8400
22280|POCKET BAG PINK PAISELY BROWN SPOT|49200
47367B|PAIR PADDED HANGERS PINK CHECK|67200
22741|FUNKY DIVA PEN|17000
23397|FOOT STOOL HOME SWEET HOME |199000
35954|SMALL FOLKART STAR CHRISTMAS DEC|16400
20764|ABSTRACT CIRCLES SKETCHBOOK |149200
84249A|GREETING CARD,SQUARE, DOUGHNUTS|16600
21784|SHOE SHINE BOX |199000
62018|SOMBRERO |39000
21658|GLASS  BEURRE DISH|79000
82567|AIRLINE LOUNGE,METAL SIGN|32600
47578A|ENGLISH ROSE SMALL SCENTED FLOWER|17000
20981|12 PENCILS TALL TUBE WOODLAND|17000
21078|SET/20 STRAWBERRY PAPER NAPKINS |17000
22575|METAL MERRY CHRISTMAS WREATH|39000
21992|VINTAGE PAISLEY STATIONERY SET|49200
21534|DAIRY MAID LARGE MILK JUG|99000
22651|GENTLEMAN SHIRT REPAIR KIT |32600
84510A|SET OF 4 ENGLISH ROSE COASTERS|25000
90158|ST TROPEZ NECKLACE|99600
21401|BLUE PUDDING SPOON|2400
90190C|SILVER/AMETHYST DROP EARRINGS LEAF|58000
22747|POPPY'S PLAYHOUSE BATHROOM|42000
23508|MINI PLAYING CARDS DOLLY GIRL |8400
21878|PACK OF 6 SANDCASTLE FLAGS ASSORTED|32600
22681|FRENCH BLUE METAL DOOR SIGN 6|49200
35961|FOLKART ZINC HEART CHRISTMAS DEC|33200
82613C|METAL SIGN,CUPCAKE SINGLE HOOK|49200
22505|MEMO BOARD COTTAGE DESIGN|85000
16225|RATTLE SNAKE EGGS|25000
16048|TEATIME ROUND PENCIL SHARPENER |16600
48173C|DOORMAT BLACK FLOCK |135000
72349B|SET/6 PURPLE BUTTERFLY T-LIGHTS|42000
23453|OVAL  MINI PORTRAIT FRAME|39000
22079|RIBBON REEL HEARTS DESIGN |65800
62095B||0
22371|AIRLINE BAG VINTAGE TOKYO 78|165800
21982|PACK OF 12 SUKI TISSUES |5800
22607|WOODEN ROUNDERS GARDEN SET |332600
22646|CERAMIC STRAWBERRY CAKE MONEY BANK|67200
40016|CHINESE DRAGON PAPER LANTERNS|8400
51014L|FEATHER PEN,LIGHT PINK|7800
20829|GLITTER HANGING BUTTERFLY STRING|42000
84509G|SET OF 4 FAIRY CAKE PLACEMATS |67200
22422|TOOTHPASTE TUBE PEN|13000
22449|SILK PURSE BABUSHKA PINK|135400
23034|DRAWER KNOB CERAMIC BLACK|29000
23029|DRAWER KNOB CRACKLE GLAZE GREEN|33000
22853|CAT BOWL VINTAGE CREAM|65000
90130B|TURQ STONE/CRYSTAL EARRINGS|58000
21865|PINK UNION JACK  PASSPORT COVER |82600
22547|MINI JIGSAW DINOSAUR |8400
16235|RECYCLED PENCIL WITH RABBIT ERASER|4200
23354|6 GIFT TAGS 50'S CHRISTMAS |16600
21194|PINK  HONEYCOMB PAPER FAN|13000
72802C|VANILLA SCENT CANDLE JEWELLED BOX|85000
37413|ICON MUG REVOLUTIONARY|7800
21813|GARLAND WITH STARS AND BELLS|65800
22691|DOORMAT WELCOME SUNRISE|159000
23497|CLASSIC CHROME BICYCLE BELL |29000
21738|COSY SLIPPER SHOES SMALL  RED |59000
22255|FELT TOADSTOOL  SMALL|32600
35095A|BLUE VICTORIAN FABRIC OVAL BOX|16600
22485|SET OF 2 WOODEN MARKET CRATES|255000
84826|ASSTD DESIGN 3D PAPER STICKERS|17000
22904|CALENDAR PAPER CUT DESIGN|59000
22535|MAGIC DRAWING SLATE BUNNIES |16600
22855|FINE WICKER HEART |25000
84313B|BLUE TV TRAY TABLE |85000
22788|BROCANTE COAT RACK|199000
23238|SET OF 4 KNICK KNACK TINS LONDON |165800
22289|HANGING METAL CHICKEN DECORATION|25000
23286|BLUE VINTAGE SPOT BEAKER|17000
21200|MULTICOLOUR HONEYCOMB PAPER GARLAND|32600
22841|ROUND CAKE TIN VINTAGE GREEN|159000
35649|VINTAGE BEAD COSMETIC BAG |49200
22441|GROW YOUR OWN BASIL IN ENAMEL MUG|82600
78124|MAGAZINE RACK GEBRA ASSORTED |25000
85034C|3 ROSE MORRIS BOXED CANDLES|25000
22183|CAKE STAND VICTORIAN FILIGREE MED|115800
22366|DOORMAT AIRMAIL |159000
22759|SET OF 3 NOTEBOOKS IN PARCEL|33000
85116|BLACK CANDELABRA T-LIGHT HOLDER|32600
21287|SCENTED VELVET LOUNGE CANDLE |7600
23269|SET OF 2 CERAMIC CHRISTMAS TREES|29000
S|SAMPLES|1900000
23559|WOODLAND BUNNIES LOLLY MAKERS|82600
20682|RED RETROSPOT CHILDRENS UMBRELLA|65000
23188|VINTAGE  2 METRE FOLDING RULER|33000
22600|CHRISTMAS RETROSPOT STAR WOOD|17000
23342|MINT DINER WALL CLOCK|170000
21846|PINK DIAMANTE PEN IN GIFT BOX|84200
84912B|GREEN ROSE WASHBAG|65800
22637|PIGGY BANK RETROSPOT |51000
84795B|SUNSET CHECK HAMMOCK|159000
20963|APPLE BATH SPONGE|25000
21592|RETROSPOT CIGAR BOX MATCHES |25000
22661|CHARLOTTE BAG DOLLY GIRL DESIGN|17000
21447|12 IVORY ROSE PEG PLACE SETTINGS|25000
85180B|PINK HEARTS LIGHT CHAIN |49200
22154|ANGEL DECORATION 3 BUTTONS |16600
21479|WHITE SKULL HOT WATER BOTTLE |75000
90129C|GREEN GLASS TASSLE BAG CHARM|32600
21781|MA CAMPAGNE CUTLERY BOX|299000
22524|CHILDRENS GARDEN GLOVES BLUE|25000
23391| I LOVE LONDON MINI BACKPACK|165800
22028|PENNY FARTHING BIRTHDAY CARD|8400
21925|UNION STRIPE CUSHION COVER |25000
84279B|CHERRY BLOSSOM DECORATIVE FLASK|75000
