22704|WRAP RED APPLES |8400
21933|PINK VINTAGE PAISLEY PICNIC BAG|49200
22081|RIBBON REEL FLORA + FAUNA |33000
22131|FOOD CONTAINER SET 3 LOVE HEART |82600
22989|SET 2 PANTRY DESIGN TEA TOWELS|55000
22629|SPACEBOY LUNCH BOX |33000
21615|4 LAVENDER BOTANICAL DINNER CANDLES|25000
35651|VINTAGE BEAD PINK SCARF |67200
22966|GINGERBREAD MAN COOKIE CUTTER|49200
84375|SET OF 20 KIDS COOKIE CUTTERS|42000
21524|DOORMAT SPOTTY HOME SWEET HOME|315800
23006|TRAVEL CARD WALLET FLOWER MEADOW|8400
85099C|JUMBO  BAG BAROQUE BLACK WHITE|41600
22580|ADVENT CALENDAR GINGHAM SACK|119000
22361|GLASS JAR DAISY FRESH COTTON WOOL|115800
21932|SCANDINAVIAN PAISLEY PICNIC BAG|33000
20704|MR ROBOT SOFT TOY|39000
21426|WOODLAND STORAGE BOX SMALL|99200
47594B|SCOTTIES DESIGN WASHBAG|33200
22910|PAPER CHAIN KIT VINTAGE CHRISTMAS|59000
22386|JUMBO BAG PINK POLKADOT|82600
90186A|AMETHYST HOOP EARRING FLORAL LEAF|59200
22785|SQUARECUSHION COVER PINK UNION JACK|135000
47566|PARTY BUNTING|99000
22428|ENAMEL FIRE BUCKET CREAM|139000
84673A|PINK FLY SWAT|13000
85123A|WHITE HANGING HEART T-LIGHT HOLDER|59000
22327|ROUND SNACK BOXES SET OF 4 SKULLS|59000
22355|CHARLOTTE BAG SUKI DESIGN|32600
20775|DAISY NOTEBOOK |32600
23317|BLUE REFECTORY CLOCK |199000
48187|DOORMAT NEW ENGLAND|159000
22993|SET OF 4 PANTRY JELLY MOULDS|25000
POST|POSTAGE|560000
22393|PAPERWEIGHT VINTAGE COLLAGE|51000
22775|PURPLE DRAWERKNOB ACRYLIC EDWARDIAN|25000
22557|PLASTERS IN TIN VINTAGE PAISLEY |33000
23582|VINTAGE DOILY JUMBO BAG RED |41600
82552|WASHROOM METAL SIGN|29000
85152|HAND OVER THE CHOCOLATE   SIGN |42000
16237|SLEEPING CAT ERASERS|4200
23232|WRAP VINTAGE LEAF DESIGN|8400
22383|LUNCH BAG SUKI  DESIGN |33000
23146|TRIPLE HOOK ANTIQUE IVORY ROSE|65800
21246|RED RETROSPOT BIG BOWL|82600
15056P|EDWARDIAN PARASOL PINK|119000
22417|PACK OF 60 SPACEBOY CAKE CASES|11000
22291|HANGING CHICK CREAM DECORATION|29000
23358|HOT STUFF HOT WATER BOTTLE|75000
35004B|SET OF 3 BLACK FLYING DUCKS|115800
20970|PINK FLORAL FELTCRAFT SHOULDER BAG|149200
22722|SET OF 6 SPICE TINS PANTRY DESIGN|82600
85049A|TRADITIONAL CHRISTMAS RIBBONS|25000
22723|SET OF 6 HERB TINS SKETCHBOOK|79000
21936|RED RETROSPOT PICNIC BAG|59000
84927F|PSYCHEDELIC TILE HOOK|7800
22045|SPACEBOY GIFT WRAP|8400
37448|CERAMIC CAKE DESIGN SPOTTED MUG|29800
21090|SET/6 COLLAGE PAPER PLATES|16600
21470|FLOWER VINE RAFFIA FOOD COVER|75000
21892|TRADITIONAL WOODEN CATCH CUP GAME |49200
20725|LUNCH BAG RED RETROSPOT|33000
22994|TRAVEL CARD WALLET RETROSPOT|8400
22797|CHEST OF DRAWERS GINGHAM HEART |339000
22906|12 MESSAGE CARDS WITH ENVELOPES|33000
22979|PANTRY WASHING UP BRUSH|65800
21867|PINK UNION JACK  LUGGAGE TAG|25000
22026|BANQUET BIRTHDAY  CARD  |8400
20749|ASSORTED COLOUR MINI CASES|159000
15056N|EDWARDIAN PARASOL NATURAL|119000
21156|RETROSPOT CHILDRENS APRON|39000
84997D|PINK 3 PIECE POLKADOT CUTLERY SET|75000
23284|DOORMAT KEEP CALM AND COME IN|159000
22024|RAINY LADIES BIRTHDAY CARD|16600
20718|RED RETROSPOT SHOPPER BAG|49200
22149|FELTCRAFT 6 FLOWER FRIENDS|42000
22626|BLACK KITCHEN SCALES|170000
21912|VINTAGE SNAKES & LADDERS|75000
22890|NOVELTY BISCUITS CAKE STAND 3 TIER|199000
21643|ASSORTED TUTTI FRUTTI MIRROR|50200
23274|STAR T-LIGHT HOLDER WILLIE WINKIE|33000
22035|VINTAGE CARAVAN GREETING CARD |16600
22638|SET OF 4 NAPKIN CHARMS CROWNS |32600
22156|HEART DECORATION WITH PEARLS |17000
23298|SPOTTY BUNTING|99000
23245|SET OF 3 REGENCY CAKE TINS|215800
20724|RED RETROSPOT CHARLOTTE BAG|14400
23343|JUMBO BAG VINTAGE CHRISTMAS |41600
23490|T-LIGHT HOLDER HANGING LOVE BIRD|75000
22178|VICTORIAN GLASS HANGING T-LIGHT|25000
22161|HEART DECORATION RUSTIC HANGING |16200
22176|BLUE OWL SOFT TOY|59000
22622|BOX OF VINTAGE ALPHABET BLOCKS|170000
21471|STRAWBERRY RAFFIA FOOD COVER|65800
23399|HOME SWEET HOME HANGING HEART|17000
21931|JUMBO STORAGE BAG SUKI|41600
22780|LIGHT GARLAND BUTTERFILES PINK|85000
22429|ENAMEL MEASURING JUG CREAM|85000
21155|RED RETROSPOT PEG BAG|99200
22951|60 CAKE CASES DOLLY GIRL DESIGN|11000
85049H|URBAN BLACK RIBBONS |16600
21558|SKULL LUNCH BOX WITH CUTLERY |51000
21329|DINOSAURS  WRITING SET |33000
85038|6 CHOCOLATE LOVE HEART T-LIGHTS|84200
22699|ROSES REGENCY TEACUP AND SAUCER |59000
90214D|LETTER "D" BLING KEY RING|16600
21181|PLEASE ONE PERSON METAL SIGN|42000
21429|RED GINGHAM ROSE JEWELLERY BOX|67200
22439|6 ROCKET BALLOONS |25000
84946|ANTIQUE SILVER T-LIGHT GLASS|25000
22616|PACK OF 12 LONDON TISSUES |7800
22546|MINI JIGSAW PURDEY|16600
22834|HAND WARMER BABUSHKA DESIGN|99200
23280|FOLDING BUTTERFLY MIRROR HOT PINK |16600
23256|CHILDRENS CUTLERY SPACEBOY |83000
22193|RED DINER WALL CLOCK|170000
22414|DOORMAT NEIGHBOURHOOD WITCH |288600
21041|RED RETROSPOT OVEN GLOVE DOUBLE|118200
22467|GUMBALL COAT RACK|51000
22219|LOVEBIRD HANGING DECORATION WHITE |17000
23619|SET 10 CARDS POINSETTIA 17093|49800
23094|LE GRAND TRAY CHIC SET|250000
22911|PAPER CHAIN KIT LONDON|118200
20846|ZINC HEART LATTICE T-LIGHT HOLDER|49200
72816|SET/3 CHRISTMAS DECOUPAGE CANDLES|49200
22329|ROUND CONTAINER SET OF 5 RETROSPOT|33000
35916B|BLUE FELT HANGING HEART WITH FLOWER|12600
22634|CHILDS BREAKFAST SET SPACEBOY |399200
84950|ASSORTED COLOUR T-LIGHT HOLDER|11000
23367|SET 12 COLOUR PENCILS SPACEBOY |25000
22610|PENS ASSORTED FUNNY FACE|3800
22960|JAM MAKING SET WITH JARS|85000
22846|BREAD BIN DINER STYLE RED |339000
21942|SKULLS DESIGN FLANNEL|33200
22649|STRAWBERRY FAIRY CAKE TEAPOT|99000
23202|JUMBO BAG VINTAGE LEAF|41600
84978|HANGING HEART JAR T-LIGHT HOLDER|25000
23437| 50'S CHRISTMAS GIFT BAG LARGE|25000
90196A|PURPLE GEMSTONE NECKLACE 45CM|255000
23510|MINI PLAYING CARDS GYMKHANA|8400
21232|STRAWBERRY CERAMIC TRINKET BOX|25000
84596F|SMALL MARSHMALLOWS PINK BOWL|16600
22261|FELT EGG COSY WHITE RABBIT |17000
90016B|GOLD/M.O.P PENDANT ORBIT NECKLACE|170000
23084|RABBIT NIGHT LIGHT|82600
21159|MOODY BOY  DOOR HANGER |7800
84609|TALL ROCOCO CANDLE HOLDER|170000
21559|STRAWBERRY LUNCH BOX WITH CUTLERY|51000
21121|SET/10 RED POLKADOT PARTY CANDLES|25000
22423|REGENCY CAKESTAND 3 TIER|255000
20977|36 PENCILS TUBE WOODLAND|25000
21703|BAG 125g SWIRLY MARBLES|8400
21754|HOME BUILDING BLOCK WORD|125000
C2|CARRIAGE|1e+06
84378|SET OF 3 HEART COOKIE CUTTERS|29000
22839|3 TIER CAKE TIN GREEN AND CREAM|299000
82484|WOOD BLACK BOARD ANT WHITE FINISH|332600
21981|PACK OF 12 WOODLAND TISSUES |5800
20726|LUNCH BAG WOODLAND|33000
22635|CHILDS BREAKFAST SET DOLLY GIRL |199000
90036D|FLOWER GLASS GARLAND NECKL.36"BLACK|159000
22569|FELTCRAFT CUSHION BUTTERFLY|75000
22158|3 HEARTS HANGING DECORATION RUSTIC|59000
20723|STRAWBERRY CHARLOTTE BAG|17000
21934|SKULL SHOULDER BAG|65800
21034|REX CASH+CARRY JUMBO SHOPPER|19000
22675|FRENCH KITCHEN SIGN BLUE METAL|25000
21033|JUMBO BAG CHARLIE AND LOLA TOYS|59000
21899|GARAGE KEY FOB|13000
21240|BLUE POLKADOT CUP|32600
21883|STARS GIFT TAPE |13000
82482|WOODEN PICTURE FRAME WHITE FINISH|51000
23292|SPACEBOY CHILDRENS CUP|25000
84692|BOX OF 24 COCKTAIL PARASOLS|6400
21211|SET OF 72 SKULL PAPER  DOILIES|29000
82578|KITCHEN METAL SIGN|11000
22869|NUMBER TILE COTTAGE GARDEN 1|82600
23529|WALL ART DOLLY GIRL |75000
23177|TREASURE ISLAND BOOK BOX|45000
22721|SET OF 3 CAKE TINS SKETCHBOOK|39000
22697|GREEN REGENCY TEACUP AND SAUCER|51000
23004|TRAVEL CARD WALLET PANTRY|8400
21061|PARTY INVITES FOOTBALL|17000
22139|RETROSPOT TEA SET CERAMIC 11 PC |99000
22950|36 DOILIES VINTAGE CHRISTMAS|58400
22556|PLASTERS IN TIN CIRCUS PARADE |33000
22801|ANTIQUE GLASS PEDESTAL BOWL|75000
22309|TEA COSY RED  STRIPE|51000
21733|RED HANGING HEART T-LIGHT HOLDER|59000
23182|TOILET SIGN OCCUPIED OR VACANT|16600
23251|VINTAGE RED ENAMEL TRIM MUG |25000
23190|BUNDLE OF 3 SCHOOL EXERCISE BOOKS  |33000
82494L|WOODEN FRAME ANTIQUE WHITE |59000
23511|EMBROIDERED RIBBON REEL EMILY |41600
48129|DOORMAT TOPIARY|159000
22230|JIGSAW TREE WITH WATERING CAN|17000
90103|PURPLE FRANGIPANI NECKLACE|49600
22964|3 PIECE SPACEBOY COOKIE CUTTER SET|42000
84836|ZINC METAL HEART DECORATION|49200
22679|FRENCH BLUE METAL DOOR SIGN 4|25000
84952C||0
22508|DOORSTOP RETROSPOT HEART|75000
22141|CHRISTMAS CRAFT TREE TOP ANGEL|42000
20685|DOORMAT RED RETROSPOT|159000
23390|DOLLY GIRL MINI BACKPACK|83000
21288|STRIPEY CHOCOLATE NESTING BOXES|65800
22464|HANGING METAL HEART LANTERN|65800
22111|SCOTTIE DOG HOT WATER BOTTLE|99000
22064|PINK DOUGHNUT TRINKET POT |7800
22287|DECORATION , WOBBLY CHICKEN, METAL |33000
22549|PICTURE DOMINOES|29000
23356|LOVE HOT WATER BOTTLE|119000
84569D|PACK 6 HEART/ICE-CREAM PATCHES|17000
21124|SET/10 BLUE POLKADOT PARTY CANDLES|25000
21199|PINK  HEART CONFETTI IN TUBE|16600
85174|S/4 CACTI CANDLES|99000
22181|SNOWSTORM PHOTO FRAME FRIDGE MAGNET|17000
22840|ROUND CAKE TIN VINTAGE RED|159000
20711|JUMBO BAG TOYS |41600
21169|YOU'RE CONFUSING ME METAL SIGN |82600
84596G|SMALL CHOCOLATES PINK BOWL|16600
22795|SWEETHEART RECIPE BOOK STAND|271400
90093|CLEAR CRYSTAL STAR PHONE CHARM|32600
23494|VINTAGE DOILY DELUXE SEWING KIT |119000
23227|FILIGREE HEART BUTTERFLY WHITE |25000
23207|LUNCH BAG ALPHABET DESIGN|33000
22726|ALARM CLOCK BAKELIKE GREEN|165800
22195|LARGE HEART MEASURING SPOONS|67200
21379|CAMPHOR WOOD PORTOBELLO MUSHROOM|49200
84879|ASSORTED COLOUR BIRD ORNAMENT|33800
85032C|CURIOUS IMAGES GIFT WRAP SET|32600
23351|ROLL WRAP 50'S CHRISTMAS|25000
22456|NATURAL SLATE CHALKBOARD LARGE |99000
21253|SET OF PICTURE FRAME  STICKERS|115800
23266|SET OF 3 WOODEN STOCKING DECORATION|25000
22470|HEART OF WICKER LARGE|59000
22937|BAKING MOULD CHOCOLATE CUPCAKES|51000
22411|JUMBO SHOPPER VINTAGE RED PAISLEY|82600
21874|GIN AND TONIC MUG|33000
85175|CACTI T-LIGHT CANDLES|8400
22915|ASSORTED BOTTLE TOP  MAGNETS |8400
23341|PINK DINER WALL CLOCK|332600
23050|RECYCLED ACAPULCO MAT GREEN|165000
21179|NO JUNK MAIL METAL SIGN|32600
23530|WALL ART ONLY ONE PERSON |99000
37450|CERAMIC CAKE BOWL + HANGING CAKES|59000
22093|MOTORING TISSUE BOX|7800
22338|STAR DECORATION PAINTED ZINC |3800
21500|PINK POLKADOT WRAP |8400
20702|PINK PADDED MOBILE|85000
84380|SET OF 3 BUTTERFLY COOKIE CUTTERS|25000
22499|WOODEN UNION JACK BUNTING|119000
22027|TEA PARTY BIRTHDAY CARD|16600
20727|LUNCH BAG  BLACK SKULL.|33000
22211|WOOD STAMP SET FLOWERS|16600
22712|CARD DOLLY GIRL |8400
21272|SALLE DE BAIN HOOK|49200
21989|PACK OF 20 SKULL PAPER NAPKINS|50200
22781|GUMBALL MAGAZINE RACK|153000
23506|MINI PLAYING CARDS SPACEBOY |8400
23199|JUMBO BAG APPLES|41600
22365|DOORMAT RESPECTABLE HOUSE|91600
21306|SET/4 DAISY MIRROR MAGNETS|5800
22805|BLUE DRAWER KNOB ACRYLIC EDWARDIAN|49200
22645|CERAMIC HEART FAIRY CAKE MONEY BANK|29000
21213|PACK OF 72 SKULL CAKE CASES|11000
22621|TRADITIONAL KNITTING NANCY|29000
22998|TRAVEL CARD WALLET KEEP CALM|16600
21623|VINTAGE UNION JACK MEMOBOARD|199000
22921|HERB MARKER CHIVES |13000
22973|CHILDREN'S CIRCUS PARADE MUG|65800
51008|AFGHAN SLIPPER SOCK PAIR|69000
23230|WRAP ALPHABET DESIGN|8400
22286|DECORATION , WOBBLY RABBIT , METAL |65800
22655|VINTAGE RED KITCHEN CABINET|2500000
85066|CREAM SWEETHEART MINI CHEST|255000
84945|MULTI COLOUR SILVER T-LIGHT HOLDER|17000
35968|FOLK ART METAL HEART T-LIGHT HOLDER|4000
23370|SET 36 COLOURING PENCILS DOILY|25000
22107|PIZZA PLATE IN BOX|65800
71101E|STANDING FAIRY POLE SUPPORT |17000
22089|PAPER BUNTING VINTAGE PAISLEY|59000
21900|KEY FOB , SHED|13000
22356|CHARLOTTE BAG PINK POLKADOT|17000
21218|RED SPOTTY BISCUIT TIN|65000
23113|PANTRY CHOPPING BOARD|99000
21361|LOVE LARGE WOOD LETTERS |255000
22720|SET OF 3 CAKE TINS PANTRY DESIGN |99000
22558|CLOTHES PEGS RETROSPOT PACK 24 |33000
21063|PARTY INVITES JAZZ HEARTS|17000
22481|BLACK TEA TOWEL CLASSIC DESIGN|16600
21251|DINOSAUR HEIGHT CHART STICKER SET|118200
21455|PAINTED YELLOW WOODEN DAISY|16600
21507|ELEPHANT, BIRTHDAY CARD, |8400
23566|EGG CUP MILKMAID HEIDI|49200
82581|TOILET METAL SIGN|25000
23458|DOLLY CABINET 3 DRAWERS |299000
21914|BLUE HARMONICA IN BOX |25000
21158|MOODY GIRL DOOR HANGER |29000
23379|PACK OF 12 RED APPLE TISSUES|7800
72807a|SET/3 ROSE CANDLE IN JEWELLED BOX|165800
84884A|ANT WHITE WIRE HEART SPIRAL|67800
35241|ENAMEL BLUE RIM BISCUIT BIN|82600
37340|MULTICOLOUR SPRING FLOWER MUG|7800
22865|HAND WARMER OWL DESIGN|35800
21465|PINK FLOWER CROCHET FOOD COVER|75000
21216|SET 3 RETROSPOT TEA,COFFEE,SUGAR|215800
23545|WRAP RED VINTAGE DOILY|8400
22738|RIBBON REEL SNOWY VILLAGE|33000
21629|SQUARE FLOOR CUSHION VINTAGE RED|159000
22433|WATERING CAN GREEN DINOSAUR|82600
22784|LANTERN CREAM GAZEBO |99000
72586|SET OF 6 HALLOWEEN GHOST T-LIGHTS|8400
21871|SAVE THE PLANET MUG|25000
21617|4 LILY  BOTANICAL DINNER CANDLES|50200
22666|RECIPE BOX PANTRY YELLOW DESIGN|59000
21427|SKULLS STORAGE BOX SMALL|99200
21137|BLACK RECORD COVER FRAME|75000
85194S|HANGING SPRING FLOWER EGG SMALL|3800
22097|SWALLOW SQUARE TISSUE BOX|7800
22560|TRADITIONAL MODELLING CLAY|25000
22570|FELTCRAFT CUSHION RABBIT|75000
84077|WORLD WAR 2 GLIDERS ASSTD DESIGNS|5800
21891|TRADITIONAL WOODEN SKIPPING ROPE|29000
21944|KITTENS DESIGN FLANNEL|32600
72800D|4 BLUE DINNER CANDLES SILVER FLOCK|51000
22625|RED KITCHEN SCALES|170000
23167|SMALL CERAMIC TOP STORAGE JAR |16600
85049E|SCANDINAVIAN REDS RIBBONS|50200
22531|MAGIC DRAWING SLATE CIRCUS PARADE  |8400
21086|SET/6 RED SPOTTY PAPER CUPS|13000
22431|WATERING CAN BLUE ELEPHANT|39000
22995|TRAVEL CARD WALLET SUKI|16600
22980|PANTRY SCRUBBING BRUSH|33000
23404|HOME SWEET HOME BLACKBOARD|215800
21165|BEWARE OF THE CAT METAL SIGN |33800
23103|JINGLE BELL HEART DECORATION|65800
23288|GREEN VINTAGE SPOT BEAKER|17000
22402|MAGNETS PACK OF 4 VINTAGE COLLAGE|7800
84032B|CHARLIE + LOLA RED HOT WATER BOTTLE|67200
21281|VINTAGE KITCHEN PRINT SEAFOOD|101200
23052|RECYCLED ACAPULCO MAT TURQUOISE|165000
23154|SET OF 4 JAM JAR MAGNETS|41600
22171|3 HOOK PHOTO SHELF ANTIQUE WHITE|170000
23523|WALL ART TREASURE AHOY |75000
85017C|ENVELOPE 50 CURIOUS IMAGES|17000
17129F|BLUE GLASS GEMS IN BAG|32600
22478|BIRDHOUSE GARDEN MARKER |49200
22978|PANTRY ROLLING PIN|75000
22322|BIRD DECORATION GREEN POLKADOT|17000
22191|IVORY DINER WALL CLOCK|170000
46118|FUNKY MONKEY CUSHION COVER|67200
15060B|FAIRY CAKE DESIGN UMBRELLA|165800
21755|LOVE BUILDING BLOCK WORD|119000
47566B|reverse previous adjustment|0
82001S|SILVER RECORD COVER FRAME|75000
23076|ICE CREAM SUNDAE LIP GLOSS|25000
23250|VINTAGE RED TRIM ENAMEL BOWL |25000
90162B|ANT SILVER LIME GREEN BOUDICCA RING|59000
21937|STRAWBERRY   PICNIC BAG|115800
22577|WOODEN HEART CHRISTMAS SCANDINAVIAN|5800
21790|VINTAGE SNAP CARDS|32600
84569A|PACK 3 IRON ON DOG PATCHES|17000
22984|CARD GINGHAM ROSE |16600
84796B|BLUE SAVANNAH PICNIC HAMPER FOR 2|165800
21109|LARGE CAKE TOWEL CHOCOLATE SPOTS|39000
22379|RECYCLING BAG RETROSPOT |82600
23357|HOT WATER BOTTLE SEX BOMB|99000
85178|VICTORIAN SEWING KIT|49200
82551|LAUNDRY 15C METAL SIGN|49200
20969|RED FLORAL FELTCRAFT SHOULDER BAG|65800
21705|BAG 500g SWIRLY MARBLES|33000
84969|BOX OF 6 ASSORTED COLOUR TEASPOONS|65800
48185|DOORMAT FAIRY CAKE|282600
22168|ORGANISER WOOD ANTIQUE WHITE |170000
21975|PACK OF 60 DINOSAUR CAKE CASES|11000
22659|LUNCH BOX I LOVE LONDON|39000
22844|VINTAGE CREAM DOG FOOD CONTAINER|170000
22084|PAPER CHAIN KIT EMPIRE|59000
21062|PARTY INVITES SPACEMAN|17000
85177|BASKET OF FLOWERS SEWING KIT|17000
23008|DOLLY GIRL BABY GIFT SET|339000
90201A|PURPLE ENAMEL FLOWER RING|59000
84997b|CHILDRENS CUTLERY RETROSPOT RED |165800
22948|METAL DECORATION NAUGHTY CHILDREN |135400
23083|SET 6 PAPER TABLE LANTERN STARS |75000
20978|36 PENCILS TUBE SKULLS|25000
22187|GREEN CHRISTMAS TREE CARD HOLDER|39000
23196|VINTAGE LEAF MAGNETIC NOTEPAD|29000
22794|SWEETHEART WIRE MAGAZINE RACK|159000
21756|BATH BUILDING BLOCK WORD|119000
22952|60 CAKE CASES VINTAGE CHRISTMAS|25600
22326|ROUND SNACK BOXES SET OF4 WOODLAND |51000
84029G|KNITTED UNION FLAG HOT WATER BOTTLE|165800
22636|CHILDS BREAKFAST SET CIRCUS PARADE|170000
84356|POMPOM CURTAIN|119000
21509|COWBOYS AND INDIANS BIRTHDAY CARD |8400
22063|CERAMIC BOWL WITH STRAWBERRY DESIGN|59000
21668|RED STRIPE CERAMIC DRAWER KNOB|25000
21654|RIDGED GLASS FINGER BOWL|7800
21084|SET/6 COLLAGE PAPER CUPS|3800
22364|GLASS JAR DIGESTIVE BISCUITS|59000
21116|OWL DOORSTOP|0
71053|WHITE METAL LANTERN|75000
21904|HOUSE WRECKING METAL SIGN |42000
51014A|FEATHER PEN,HOT PINK|7800
22086|PAPER CHAIN KIT 50'S CHRISTMAS |132600
21730|GLASS STAR FROSTED T-LIGHT HOLDER|99000
22571|ROCKING HORSE RED CHRISTMAS |17000
23242|TREASURE TIN BUFFALO BILL |41600
22933|BAKING MOULD EASTER EGG MILK CHOC|59000
23204|CHARLOTTE BAG APPLES DESIGN|17000
21094|SET/6 RED SPOTTY PAPER PLATES|17000
22891|TEA FOR ONE POLKADOT|165800
22229|BUNNY WOODEN PAINTED WITH FLOWER |16600
22647|CERAMIC LOVE HEART MONEY BANK|29000
23554|LANDMARK FRAME OXFORD STREET|250000
22866|HAND WARMER SCOTTY DOG DESIGN|42000
22210|WOOD STAMP SET BEST WISHES|16600
21621|VINTAGE UNION JACK BUNTING|170000
90003D|CRYSTAL PAIR HEART HAIR SLIDES|74600
22736|RIBBON REEL MAKING SNOWMEN |33000
23294|SET OF 6 SNACK LOAF BAKING CASES|49200
71459|HANGING JAM JAR T-LIGHT HOLDER|17000
85212|MINI PAINTED GARDEN DECORATION |5800
84970S|HANGING HEART ZINC T-LIGHT HOLDER|41600
22077|6 RIBBONS RUSTIC CHARM|39000
22971|QUEENS GUARD COFFEE MUG|51000
22303|COFFEE MUG APPLES DESIGN|51000
23012|GLASS APOTHECARY BOTTLE PERFUME|165800
21555|CERAMIC STRAWBERRY TRINKET TRAY|49200
22074|6 RIBBONS SHIMMERING PINKS |17000
22854|CREAM SWEETHEART EGG HOLDER|99000
22112|CHOCOLATE HOT WATER BOTTLE|249200
85099B|JUMBO BAG RED RETROSPOT|41600
23091|ZINC HERB GARDEN CONTAINER|125000
90165A|PINK ROSEBUD PEARL EARRINGS|49600
23355|HOT WATER BOTTLE KEEP CALM|99000
22667|RECIPE BOX RETROSPOT |59000
22727|ALARM CLOCK BAKELIKE RED |75000
21557|SET OF 6 FUNKY BEAKERS|114800
22585|PACK OF 6 BIRDY GIFT TAGS|25000
35970|ZINC FOLKART SLEIGH BELLS|29800
23331|DECORATIVE WICKER HEART SMALL|12600
23222|CHRISTMAS TREE HANGING GOLD|16600
22849|BREAD BIN DINER STYLE MINT|339000
21773|DECORATIVE ROSE BATHROOM BOTTLE|8400
22628|PICNIC BOXES SET OF 3 RETROSPOT |99000
20728|LUNCH BAG CARS BLUE|82600
22457|NATURAL SLATE HEART CHALKBOARD |59000
22492|MINI PAINT SET VINTAGE |13000
48116|DOORMAT MULTICOLOUR STRIPE|288600
72801C|4 ROSE PINK DINNER CANDLES|25000
22812|PACK 3 BOXES CHRISTMAS PANETTONE|82600
23337|EGG FRYING PAN MINT |41600
35471D|SET OF 3 BIRD LIGHT PINK FEATHER |7800
22469|HEART OF WICKER SMALL|29000
22445|PENCIL CASE LIFE IS BEAUTIFUL|59000
21497|FANCY FONTS BIRTHDAY WRAP|7200
21504|SKULLS GREETING CARD|16600
23371|SET 36 COLOUR PENCILS SPACEBOY |25000
85170C|SET/6 EAU DE NIL BIRD T-LIGHTS|42000
23102|SILVER HEARTS TABLE DECORATION|49200
22791|T-LIGHT GLASS FLUTED ANTIQUE|49200
20974|12 PENCILS SMALL TUBE SKULL|13000
22893|MINI CAKE STAND T-LIGHT HOLDER|16600
84347|ROTATING SILVER ANGELS T-LIGHT HLDR|101200
21864|UNION JACK FLAG PASSPORT COVER |82600
22460|EMBOSSED GLASS TEALIGHT HOLDER|25000
22990|COTTON APRON PANTRY DESIGN|85000
22934|BAKING MOULD EASTER EGG WHITE CHOC|59000
22023|EMPIRE BIRTHDAY CARD|16600
21217|RED RETROSPOT ROUND CAKE TINS|199000
37500|TEA TIME TEAPOT IN GIFT BOX|165800
22624|IVORY KITCHEN SCALES|332600
22986|WRAP GINGHAM ROSE |8400
22630|DOLLY GIRL LUNCH BOX|39000
35833P|4 PINK FLOCK CHRISTMAS BALLS|67200
22730|ALARM CLOCK BAKELIKE IVORY|75000
20719|WOODLAND CHARLOTTE BAG|49200
22222|CAKE PLATE LOVEBIRD WHITE|82600
23174|REGENCY SUGAR BOWL GREEN|83000
21792|CLASSIC FRENCH STYLE BASKET GREEN |79000
23415|HOME SWEET HOME HOOK|33000
22847|BREAD BIN DINER STYLE IVORY|665800
21166|COOK WITH WINE METAL SIGN |82600
22678|FRENCH BLUE METAL DOOR SIGN 3|49200
22685|FRENCH BLUE METAL DOOR SIGN 0|0
22735|RIBBON REEL SOCKS AND MITTENS|65800
22491|PACK OF 12 COLOURED PENCILS|17000
21993|FLORAL FOLK STATIONERY SET|49200
22374|AIRLINE BAG VINTAGE JET SET RED|165800
21395|BLUE POLKADOT BEAKER |7800
84832|ZINC WILLIE WINKIE  CANDLE STICK|17000
22300|COFFEE MUG DOG + BALL DESIGN|99200
22224|WHITE LOVEBIRD LANTERN|59000
22465|HANGING METAL STAR LANTERN|65800
21314|SMALL GLASS HEART TRINKET POT|82600
85088|CANDY SPOT HAND BAG|33200
90174|BUTTERFLY HAIR BAND|51000
47590A|BLUE HAPPY BIRTHDAY BUNTING|109000
84406B|CREAM CUPID HEARTS COAT HANGER|83000
22116|METAL SIGN HIS DINNER IS SERVED|32600
22733|3D TRADITIONAL CHRISTMAS STICKERS|49200
23192|BUNDLE OF 3 ALPHABET EXERCISE BOOKS|33000
22518|CHILDS GARDEN BRUSH BLUE|42000
48138|DOORMAT UNION FLAG|165000
21411|GINGHAM HEART  DOORSTOP RED|85000
84596E|SMALL LICORICE DES PINK BOWL|8400
21055|TOOL BOX SOFT TOY |332600
15056BL|EDWARDIAN PARASOL BLACK|119000
22807|SET OF 6 T-LIGHTS TOADSTOOLS|49200
22663|JUMBO BAG DOLLY GIRL DESIGN|49200
23486|ANTIQUE HEART SHELF UNIT|267000
21930|JUMBO STORAGE BAG SKULLS|82600
20914|SET/5 RED RETROSPOT LID GLASS BOWLS|115800
22633|HAND WARMER UNION JACK|42000
20832|RED FLOCK LOVE HEART PHOTO FRAME|17000
21650|ASSORTED TUTTI FRUTTI BRACELET|16600
22436|12 COLOURED PARTY BALLOONS|13000
23310|BUBBLEGUM RING ASSORTED|8400
23263|SET OF 3 WOODEN HEART DECORATIONS|25000
21533|RETROSPOT LARGE MILK JUG|99000
23321|SMALL WHITE HEART OF WICKER|33000
21802|CHRISTMAS TREE HEART DECORATION|8400
22752|SET 7 BABUSHKA NESTING BOXES|170000
21803|CHRISTMAS TREE STAR DECORATION|8400
22507|MEMO BOARD RETROSPOT  DESIGN|99000
22996|TRAVEL CARD WALLET VINTAGE TICKET|8400
21380|WOODEN HAPPY BIRTHDAY GARLAND|115800
22271|FELTCRAFT DOLL ROSIE|59000
23205|CHARLOTTE BAG VINTAGE ALPHABET |17000
23216|LAUREL HEART ANTIQUE GOLD|25000
21192|WHITE BELL HONEYCOMB PAPER |65800
21974|SET OF 36 PAISLEY FLOWER DOILIES|29000
22925|BLUE GIANT GARDEN THERMOMETER|119000
22731|3D CHRISTMAS STAMPS STICKERS |25000
22207|FRYING PAN UNION FLAG|165800
21382|SET/4 SPRING FLOWER DECORATION|32600
21210|SET OF 72 RETROSPOT PAPER  DOILIES|29000
51014C|FEATHER PEN,COAL BLACK|7800
22822|CREAM WALL PLANTER HEART SHAPED|119000
23311|VINTAGE CHRISTMAS STOCKING |51000
85199L|LARGE HANGING IVORY & RED WOOD BIRD|13000
23208|LUNCH BAG VINTAGE LEAF DESIGN|33000
M|Manual|4775600
20992|JAZZ HEARTS PURSE NOTEBOOK|7800
22245|HOOK, 1 HANGER ,MAGIC GARDEN|17000
85136A|YELLOW SHARK HELICOPTER|169400
22676|FRENCH BLUE METAL DOOR SIGN 1|49200
21064|BOOM BOX SPEAKER BOYS|119000
22561|WOODEN SCHOOL COLOURING SET|29000
22956|36 FOIL HEART CAKE CASES|42000
23175|REGENCY MILK JUG PINK |65000
22698|PINK REGENCY TEACUP AND SAUCER|59000
23439|HAND WARMER RED LOVE HEART|42000
22644|CERAMIC CHERRY CAKE MONEY BANK|29000
23334|IVORY WICKER HEART SMALL|12600
17012C|ORIGAMI LAVENDER INCENSE/CANDL SET |17000
21616|4 PEAR BOTANICAL DINNER CANDLES|65800
23503|PLAYING CARDS KEEP CALM & CARRY ON|25000
23329|DECORATIVE WICKER HEART LARGE|33000
20996|JAZZ HEARTS ADDRESS BOOK|3800
20751|FUNKY WASHING UP GLOVES ASSORTED|42000
85096|label mix up|0
22963|JAM JAR WITH GREEN LID|32600
23543|WALL ART KEEP CALM |165000
21498|RED RETROSPOT WRAP |8400
20754|RETROSPOT RED WASHING UP GLOVES|82600
22037|ROBOT BIRTHDAY CARD|8400
90060F|FIRE POLISHED GLASS NECKL GREEN|116400
85176|SEWING SUSAN 21 NEEDLE SET|17000
22914|BLUE COAT RACK PARIS FASHION|99000
23302|KNEELING MAT HOUSEWORK  DESIGN|33000
21731|RED TOADSTOOL LED NIGHT LIGHT|65800
22750|FELTCRAFT PRINCESS LOLA DOLL|75000
23402|HOME SWEET HOME 3 PEG HANGER |75000
21454|PAINTED PINK RABBIT |16600
22977|DOLLY GIRL CHILDRENS EGG CUP|25000
21929|JUMBO BAG PINK VINTAGE PAISLEY|82600
22243|5 HOOK HANGER RED MAGIC TOADSTOOL|33000
21484|CHICK GREY HOT WATER BOTTLE|85000
21136|PAINTED METAL PEARS ASSORTED|33800
21389|IVORY HANGING DECORATION  BIRD|17000
21485|RETROSPOT HEART HOT WATER BOTTLE|99000
22654|DELUXE SEWING KIT |119000
21908|CHOCOLATE THIS WAY METAL SIGN|42000
22672|FRENCH BATHROOM SIGN BLUE METAL|67200
84991|60 TEATIME FAIRY CAKE CASES|11000
23291|DOLLY GIRL CHILDRENS CUP|25000
22029|SPACEBOY BIRTHDAY CARD|8400
22346|PARTY PIZZA DISH GREEN POLKADOT|8400
22209|WOOD STAMP SET HAPPY BIRTHDAY|32600
22617|BAKING SET SPACEBOY DESIGN|99000
22714|CARD BIRTHDAY COWBOY|16600
22715|CARD WEDDING DAY|8400
22677|FRENCH BLUE METAL DOOR SIGN 2|25000
21888|BINGO SET|75000
84987|SET OF 36 TEATIME PAPER DOILIES|29000
22588|CARD HOLDER GINGHAM HEART|57800
84596L|BISCUITS SMALL BOWL LIGHT BLUE|16600
16161U|WRAP SUKI AND FRIENDS|8400
22091|EMPIRE TISSUE BOX|7800
21906|PHARMACIE FIRST AID TIN|265800
22075|6 RIBBONS ELEGANT CHRISTMAS |29000
48184|DOORMAT ENGLISH ROSE |159000
20972|PINK CREAM FELT CRAFT TRINKET BOX |25000
23201|JUMBO BAG ALPHABET|41600
85040A|S/4 PINK FLOWER CANDLES IN BOWL|33000
22926|IVORY GIANT GARDEN THERMOMETER|119000
85049C|ROMANTIC PINKS RIBBONS |25000
23461|SWEETHEART BIRD HOUSE|165800
21356|TOAST ITS - FAIRY FLOWER|16600
22305|COFFEE MUG PINK PAISLEY DESIGN|51000
22115|METAL SIGN EMPIRE TEA|15800
21248|DOOR HANGER  MUM + DADS ROOM|29000
23228|FILIGREE HEART BIRD WHITE |49200
23328|SET 6 SCHOOL MILK BOTTLES IN CRATE|75000
23241|TREASURE TIN GYMKHANA DESIGN|41600
22568|FELTCRAFT CUSHION OWL|75000
23306|SET OF 36 DOILIES PANTRY DESIGN|29000
85131B|BEADED CRYSTAL HEART GREEN ON STICK|16600
79000|MOROCCAN TEA GLASS|17000
21110|LARGE CAKE TOWEL PINK SPOTS|135000
22540|MINI JIGSAW CIRCUS PARADE |8400
21935|SUKI  SHOULDER BAG|33200
21122|SET/10 PINK POLKADOT PARTY CANDLES|25000
22707|WRAP MONSTER FUN |8400
21363|HOME SMALL WOOD LETTERS|99000
10133|COLOURING PENCILS BROWN TUBE|16600
84988|SET OF 72 PINK HEART PAPER DOILIES|29000
22908|PACK OF 20 NAPKINS RED APPLES|17000
21035|SET/2 RED RETROSPOT TEA TOWELS |132600
22328|ROUND SNACK BOXES SET OF 4 FRUITS |59000
23272|TREE T-LIGHT HOLDER WILLIE WINKIE|33000
22345|PARTY PIZZA DISH BLUE POLKADOT|17000
21672|WHITE SPOT RED CERAMIC DRAWER KNOB|25000
23155|KNICKERBOCKERGLORY MAGNET ASSORTED |16600
22586|FELTCRAFT HAIRBAND PINK AND BLUE|32600
23173|REGENCY TEAPOT ROSES |199000
22144|CHRISTMAS CRAFT LITTLE FRIENDS|42000
22197|SMALL POPCORN HOLDER|17000
20772|GARDEN PATH JOURNAL|51000
21876|POTTERING MUG|25000
23289|DOLLY GIRL CHILDRENS BOWL|49200
23308|SET OF 60 VINTAGE LEAF CAKE CASES |11000
22284|HEN HOUSE DECORATION|65800
22520|CHILDS GARDEN TROWEL BLUE |17000
22969|HOMEMADE JAM SCENTED CANDLES|29000
20677|PINK POLKADOT BOWL|25000
22567|20 DOLLY PEGS RETROSPOT|25000
22670|FRENCH WC SIGN BLUE METAL|25000
21407|BROWN CHECK CAT DOORSTOP |85000
22776|SWEETHEART CAKESTAND 3 TIER|199000
